INSERT INTO RaceResults (Pos,Naam,Cat,Total,Race,RaceDate) VALUES ('2', 'Bram Smit', 'Msen', '1:19:43', 'De Halve van Vroomshoop', '2019-02-24');
INSERT INTO RaceResults (Naam,Afstand,Total,Race,RaceDate) VALUES ('Thijs Wiggers', '21', '1:17:54', 'Ameland Adventure Run', '2018-12-15'),('Ernst van Bergen', '21', '1:24:31', 'Ameland Adventure Run', '2018-12-15'),('Rutger Duursma', '10', '37:51', 'Ameland Adventure Run', '2018-12-15'),('Jesse Nijboer', '21', '1:36:23', 'Ameland Adventure Run', '2018-12-15'),('Anne van Wijngaarden', '21', '1:52:40', 'Ameland Adventure Run', '2018-12-15'),('Johanna Lorenz', '21', '1:35:53', 'Ameland Adventure Run', '2018-12-15'),('Anne Wouda', '5', '27:15', 'Ameland Adventure Run', '2018-12-15'),('Fenna Heijnen', '21', '1:43:09', 'Ameland Adventure Run', '2018-12-15'),('Claar Hoeve', '5', '29:08', 'Ameland Adventure Run', '2018-12-15'),('Marieke van der Zee', '5', '27:16', 'Ameland Adventure Run', '2018-12-15'),('Franciska Schutter', '21', '1:36:21', 'Ameland Adventure Run', '2018-12-15'),('Harm-Jan Stuut', '21', '1:29:39', 'Ameland Adventure Run', '2018-12-15'),('Lotte Wouda', '5', '39:04', 'Ameland Adventure Run', '2018-12-15'),('Ina Karn', '10', '50:56', 'Ameland Adventure Run', '2018-12-15'),('Martine Knol', '5', '30:22', 'Ameland Adventure Run', '2018-12-15'),('Sanne Tol', '10', '51:30', 'Ameland Adventure Run', '2018-12-15'),('Floor Metz', '21', '1:47:04', 'Ameland Adventure Run', '2018-12-15'),('Renske Wold', '5', '27:10', 'Ameland Adventure Run', '2018-12-15'),('Bart Smink', '5', '19:38', 'Ameland Adventure Run', '2018-12-15'),('Zoë Mens', '5', '26:53', 'Ameland Adventure Run', '2018-12-15'),('Jordi Fuhler', '5', '19:06', 'Ameland Adventure Run', '2018-12-15'),('Alex Tonks', '10', '49:12', 'Ameland Adventure Run', '2018-12-15'),('Ingeborg Wolthuis', '10', '51:29', 'Ameland Adventure Run', '2018-12-15');
INSERT INTO RaceResults (Naam,Cat,Total,Race,RaceDate) VALUES ('Dennis Weerdenburg', 'M', '3:09:08', 'Marathon van Eindhoven', '2018-10-14');
INSERT INTO RaceResults (Naam,Cat,Total,Race,RaceDate) VALUES ('Jesse Nijboer', 'M', '22:59', '4 mijl van Groningen', '2018-10-14'),('Franciska Schutter', 'V', '27:02', '4 mijl van Groningen', '2018-10-14'),('Fenna Heijnen', 'V', '27:58', '4 mijl van Groningen', '2018-10-14'),('Floor Metz', 'V', '29:18', '4 mijl van Groningen', '2018-10-14'),('Johanna Lorenz', 'V', '25:54', '4 mijl van Groningen', '2018-10-14');
INSERT INTO RaceResults (Bib,Naam,Cat,PosCat,Pos,Swim,T1,Bike,T2,Run,Total,Race,RaceDate) VALUES ('422', 'Janika Ranta-Ylitalo', '20-24', '1', '116', '26:44', '03:42', '01:19:43', '01:12', '51:26', '02:42:47', 'Finntriathlon kwart Triathlon', '2018-08-13');
INSERT INTO RaceResults (PosCat,Bib,Total,Naam,Cat,Club,Swim,PosSwim,Bike,PosBike,AfterBike,PosAftBike,Run,PosRun,Total,Pos) VALUES ('2', '527', '04:17:26', 'Edwin Dasselaar', 'TM-25', 'GSTV Tritanium', '00:30:03', '4', '02:21:10', '3', '02:51:13', '3', '01:26:12', '2', '04:17:26', '2'),('3', '531', '04:22:20', 'Bram Smit', 'TM-25', 'GSTV Tritanium', '00:30:15', '5', '02:18:41', '2', '02:48:56', '2', '01:33:23', '3', '04:22:20', '4'),('4', '547', '04:48:18', 'Sam Kamminga', 'TM-30', 'GVAV Triathlon Groningen', '00:36:06', '8', '02:27:53', '3', '03:03:59', '3', '01:44:19', '7', '04:48:18', '21'),('4', '583', '04:52:41', 'Jens Rasmussen', 'TM-40', 'GSTV Tritanium', '00:32:40', '6', '02:25:29', '1', '02:58:09', '1', '01:54:31', '12', '04:52:41', '25'),('2', '502', '05:21:21', 'Margot Reinders', 'TW-20', 'GSTV Tritanium', '00:37:21', '4', '02:52:22', '1', '03:29:43', '3', '01:51:37', '2', '05:21:21', '6'),('5', '518', '05:49:08', 'David van Eekhout', 'TM-20', 'GSTV Tritanium', '00:32:00', '4', '02:43:36', '3', '03:15:37', '3', '02:33:30', '9', '05:49:08', '119');
INSERT INTO RaceResults (Bib,Naam,Cat,PosCat,Pos,Swim,T1,Bike,T2,Run,Total,Race,RaceDate) VALUES ('46', 'Janika Ranta-Ylitalo', '20-24', '3', '278', '37:42', '02:03', '02:37:14', '02:16', '1:59:14', '05:18:31', 'Finntriathlon Joroinen Half Triathlon', '2018-07-21');
INSERT INTO RaceResults (Naam,PosCat,Pos,Swim,Bike,Run,Total) VALUES ('Hielke Nobel', '31', '844', '00:37:00', '02:42:57', '02:10:53', '05:40:30');
INSERT INTO RaceResults (Pos,Naam,Bib,Team,Cat,Swim,T1,Bike,BikePace,AfterBike,T2,Run,Total) VALUES ('1', 'Jacob Veenstra', '2', 'GVAV', 'M', '01:12:48', '04:24', '4:39:25', '38.6', '05:56:36', '02:04', '03:10:02', '09:08:41');
INSERT INTO RaceResults (Pos,Bib,Cat,Naam,Club,Swim,PosSwim,T1,PosT1,Bike,PosBike,AfterBike,PosAftBike,T2,PosT2,Run,PosRun,Total,Difference) VALUES ('14', '513', 'D3M', 'Symen de Jong', 'Triteam Groningen 3', '00:21:03', '2', '00:00:46', '3', '01:07:35', '44', '01:29:23', '20', '00:01:05', '33', '00:39:32', '17', '02:09:59', '00:05:24');
INSERT INTO RaceResults (Pos,Bib,Cat,Naam,City,Swim,PosSwim,T1,PosT1,Bike,PosBike,AfterBike,PosAftBike,T2,PosT2,Run,PosRun,Total,Difference) VALUES ('1', '164', 'D18', 'Marieke van den Brink', 'Groningen', '00:27:45', '1', '00:01:05', '1', '01:19:44', '2', '01:48:33', '1', '00:01:13', '1', '00:48:03', '1', '02:37:48', '');
INSERT INTO RaceResults (Pos,Naam,Bib,Team,Cat,Swim,SwimPace,PosSwim,T1,PosT1,Bike,BikePace,PosBike,T2,PosT2,Run,RunPace,PosRun,Total) VALUES ('1', 'Franciska Schutter', '390', 'GSTV Tritanium', 'V', '15:49', '01:35', '10', '01:19', '1', '01:06:05', '38.14', '14', '01:12', '4', '50:13', '04:34', '26', '02:14:37'),('2', 'Elsemieke Stokman', '410', 'GSTV Tritanium', 'V', '16:58', '01:42', '16', '01:23', '3', '01:07:15', '37.48', '16', '01:11', '3', '49:46', '04:31', '21', '02:16:31'),('6', 'Janika Ranta-Ylitalo', '454', '', 'V', '18:09', '01:43', '19', '01:47', '18', '01:16:55', '32.77', '57', '01:36', '21', '01:01:39', '05:36', '71', '02:39:04');
INSERT INTO RaceResults (Pos,Naam,Bib,Team,Cat,PosCat,Swim,SwimPace,PosSwim,T1,PosT1,Bike,BikePace,PosBike,T2,PosT2,Run,RunPace,PosRun,Total) VALUES ('1', 'Jacob Veenstra', '371', 'GVAV', 'M', '1', '13:54', '01:23', '1', '01:33', '8', '01:00:04', '41.97', '1', '01:38', '23', '41:11', '03:45', '1', '01:58:18'),('16', 'Bart Wolters', '442', '', 'M', '15', '17:11', '01.43', '20', '02:18', '35', '01:06:36', '37.85', '15', '01:25', '13', '48:43', '04:26', '14', '02:16:11');
INSERT INTO RaceResults (Pos,Naam,Bib,Team,Cat,Swim,SwimPace,PosSwim,T1,PosT1,Bike,BikePace,PosBike,T2,PosT2,Run,RunPace,PosRun,Total) VALUES ('1', 'Fenna Heijnen', '196', 'GSTV Tritanium', 'V', '08:02', '01:36', '13', '01:32', '', '39:02', '33.83', '22', '01:15', '9', '22:53', '04:09', '10', '01:12:42'),('6', 'Lilian van Stratum', '297', 'GSTV Tritanium', 'V', '09:39', '1:56', '37', '01:28', '10', '41:53', '31.53', '50', '01:22', '17', '26:12', '4:46', '39', '01:20:30'),('15', 'Friederike Rost', '328', 'GSTV Tritanium', 'V', '08:53', '1:47', '24', '02:32', '66', '44:40', '29.56', '77', '02:00', '71', '24:56', '04:32', '28', '01:23:00');
INSERT INTO RaceResults (Pos,Naam,Bib,Team,Cat,Swim,SwimPace,PosSwim,T1,PosT1,Bike,BikePace,PosBike,T2,PosT2,Run,RunPace,PosRun,Total) VALUES ('3', 'Jordi Fuhler', '242', 'Triathlonteam De Boks', 'M', '07:10', '01:26', '4', '01:17', '3', '34:32', '38.24', '6', '01:10', '4', '21:07', '03:50', '4', '01:05:14'),('4', 'Anton Stempher', '292', 'GVAV', 'M', '07:44', '01:33', '9', '01:23', '8', '34:15', '38.58', '5', '00:59', '1', '21:28', '03:54', '5', '01:05:46'),('8', 'Emiel Harder', '271', '', 'M', '09:49', '01:58', '41', '01:19', '5', '38:34', '34.24', '19', '01:19', '14', '22:31', '04:05', '9', '01:13:30'),('16', 'Thomas van Belle', '324', 'GSTV Tritanium', 'M', '08:24', '01:41', '17', '02:24', '59', '39:58', '33.04', '32', '01:34', '32', '23:25', '04:15', '16', '01:15:43');
INSERT INTO RaceResults (Pos,Naam,Bib,Team,Cat,Swim,SwimPace,PosSwim,T1,PosT1,Bike,BikePace,PosBike,T2,PosT2,Run,RunPace,PosRun,Total) VALUES ('90', 'Alex Tonks', '703', 'Triteam Groningen', '4eDiv', '27:58', '01:52', '70', '01:39', '21', '01:14:14', '33.95', '77', '01|31', '33', '01:04:41', '05:53', '95', '02:50:01');
INSERT INTO RaceResults (Pos,Bib,Naam,City,Cat,Swim,PosSwim,T1,Bike,PosBike,AfterBike,PosAftBike,T2,Run,PosRun,Total) VALUES ('1', '515', 'Joost Somsen', 'EIBERGEN', 'H14', '00:06:34', '1', '00:00:28', '00:27:41', '1', '00:34:43', '1', '00:00:26', '00:17:31', '1', '00:52:38');
INSERT INTO RaceResults (Pos,TeamRank,Naam,Club,Run1,T1,Bike,T2,Run2,Total) VALUES ('12', '7', 'Fenna Heijnen', 'Triteam Groningen', '00:00', '00:00', '00:00', '00:00', '00:00', '1:11:26');
INSERT INTO RaceResults (Pos,TeamRank,Naam,Club,Run1,T1,Bike,T2,Run2,Total) VALUES ('2', '1', 'Thijs Wiggers', 'TriCan Nijmegen', '00:00', '00:00', '00:00', '00:00', '00:00', '57:57'),('5', '3', 'Bram Smit', 'Triteam Groningen', '00:00', '00:00', '00:00', '00:00', '00:00', '59:18'),('11', '3', 'Jesse Nijboer', 'Triteam Groningen', '00:00', '00:00', '00:00', '00:00', '00:00', '1:00:23'),('22', '3', 'Jeroen van Schaik', 'Triteam Groningen', '00:00', '00:00', '00:00', '00:00', '00:00', '1:03:12');
INSERT INTO RaceResults (Pos,Naam,City,Total) VALUES ('10', 'Maarten Oosterhuis', 'Groningen', '1:33:32');
INSERT INTO RaceResults (Pos,Bib,Cat,Naam,Swim,PosSwim,T1,PosT1,Bike,PosBike,AfterBike,PosAftBike,T2,PosT2,Run,PosRun,Total) VALUES ('28', '29', '', 'Fenna Heijnen', '00:13:03', '35', '00:01:06', '28', '00:32:20', '5', '00:46:28', '23', '00:01:14', '14', '00:21:16', '31', '01:08:58'),('39', '32', '', 'Elsemieke Stokman', '00:13:23', '38', '00:01:01', '13', '00:33:35', '37', '00:47:58', '39', '00:01:24', '38', '00:22:44', '39', '01:12:05'),('40', '31', '', 'Margot Reinders', '00:13:41', '42', '00:01:03', '21', '00:33:12', '32', '00:47:55', '38', '00:01:23', '37', '00:23:04', '40', '01:12:22');
INSERT INTO RaceResults (Pos,Bib,Naam,Cat,PosCat,Swim,PosSwim,T1,Bike,PosBike,AfterBike,PosAftBike,T2,Run,PosRun,Total) VALUES ('1', '6', 'Henk-Jan Dolsma', 'M-40', '1', '00:18:38', '1', '00:00:38', '00:56:03', '2', '01:15:19', '2', '00:00:34', '00:38:45', '2', '01:54:37');
INSERT INTO RaceResults (Pos,Bib,Cat,Naam,City,Swim,PosSwim,T1,PosT1,Bike,PosBike,AfterBike,PosAftBike,T2,PosT2,Run,PosRun,Total) VALUES ('74', '366', 'H18+', 'Hielke Nobel', 'Groningen', '00:29:47', '108', '00:02:23', '62', '01:07:48', '59', '01:39:57', '67', '00:01:47', '34', '00:50:29', '92', '02:32:12');
INSERT INTO RaceResults (Pos,Naam,City,Total) VALUES ('2', 'Franciska Schutter', 'Groningen', '01:02:41'),('10', 'Milou Berends', 'Groningen', '01:07:47'),('15', 'Anne Wouda', 'Groningen', '01:13:21'),('22', 'Feya Boomsma', 'Groningen', '01:30:33');
INSERT INTO RaceResults (Pos,Naam,City,Total) VALUES ('1', 'Bram Smit', 'Groningen', '00:54:54'),('2', 'Thijs Wiggers', 'Groningen', '00:55:36'),('4', 'Bart Smink', 'Groningen', '00:56:48'),('6', 'Jeroen van Schaik', 'Groningen', '01:00:38'),('7', 'Ernst van Bergen', 'Groningen', '01:02:06');
INSERT INTO RaceResults (Pos,Bib,Naam,City,PosCat,Cat,Total) VALUES ('167', '600', 'Emiel Harder', 'Craft Benelux', '91', 'Mrecr', '1:32:08'),('1598', '2131', 'Thijs de Roo', 'Zwolle', '1288', 'Mrecr', '1:55:25');
INSERT INTO RaceResults (Pos,Bib,Naam,Team,Swim,PosSwim,T1,Bike,PosBike,AfterBike,T2,Run,PosRun,Total) VALUES ('20', '6', 'Lydwien Wilbers', 'Triteam Groningen 2', '00:26:47', '16', '00:00:51', '00:57:50', '20', '01:25:26', '00:03:45', '00:48:11', '39', '02:17:22');
INSERT INTO RaceResults (Pos,Bib,Naam,Team,Swim,PosSwim,T1,Bike,PosBike,AfterBike,T2,Run,PosRun,Total) VALUES ('1', '1', 'Rutger Duursma', 'Triteam Groningen', '00:21:31', '4', '00:00:42', '00:51:38', '24', '01:13:50', '00:02:59', '00:36:07', '2', '01:52:55'),('12', '4', 'Jacob Veenstra', 'Triteam Groningen', '00:22:43', '14', '00:00:48', '00:51:30', '19', '01:15:01', '00:03:49', '00:37:48', '13', '01:56:37'),('19', '27', 'Edwin Dasselaar', 'Ferro Mosae - Maastricht', '00:25:13', '48', '00:00:50', '00:52:33', '41', '01:18:36', '00:03:13', '00:36:01', '1', '01:57:49'),('36', '46', 'Jordi Fuhler', 'De Boks - Klazienaveen', '00:25:19', '50', '00:00:47', '00:52:33', '42', '01:18:39', '00:03:25', '00:39:30', '26', '02:01:33');
INSERT INTO RaceResults (Pos,Naam,Swim,Bike,Run,Total,Race,RaceDate) VALUES ('3', 'Anne van Wijngaarden', '06:23', '00:27:17', '25:09', '1:01:10', 'Healthyfest minitriatlon', '2018-06-09');
INSERT INTO RaceResults (Pos,Bib,Naam,City,Total,Difference,BikePace) VALUES ('4', '15', 'Jens Rasmussen', 'Groningen', '20:22.34', '0:20', '43.147');
INSERT INTO RaceResults (Pos,Bib,Naam,City,Cat,Swim,PosSwim,T1,Bike,PosBike,AfterBike,PosAftBike,T2,Run,PosRun,Total) VALUES ('15', '75', 'Bram Smit', 'NOORDHORN', 'H20+', '00:31:51', '15', '00:01:48', '02:15:45', '13', '02:49:23', '12', '00:01:06', '01:35:51', '30', '04:26:19');
INSERT INTO RaceResults (Pos,Bib,Naam,Cat,Swim,PosSwim,T1,Bike,PosBike,AfterBike,PosAftBike,T2,Run,PosRun,Total) VALUES ('3', '2035', 'Joost Somsen', 'H16+', '00:09:15', '17', '00:00:48', '00:30:11', '1', '00:40:13', '6', '00:01:00', '00:17:06', '5', '00:58:18');
INSERT INTO RaceResults (Bib,Naam,City,Cat,Swim,PosSwim,T1,PosT1,Bike,PosBike,AfterBike,PosAftBike,T2,PosT2,Run,PosRun,Total) VALUES ('49', 'Milou Berends', 'GRONINGEN', 'V', '0:21:23', '19', '0:01:39', '18', '1:13:37', '9', '1:36:37', '16', '0:01:47', '18', '0:46:55', '2', '2:25:18');
INSERT INTO RaceResults (Pos,Naam,City,Total) VALUES ('2', 'Margot Reinders', 'Groningen', '44:37');
INSERT INTO RaceResults (Pos,Naam,City,Total) VALUES ('1', 'Edwin Dasselaar', 'Maastricht', '36:25');
INSERT INTO RaceResults (Pos,Bib,Cat,PosCat,Naam,Club,Swim,SwimPace,PosSwim,T1,Bike,BikePace,PosBike,T2,Run,RunPace,PosRun,Total,Race,RaceDate) VALUES ('2059', '477', 'V25-29', '38', 'Klazina Korver', 'GSTV Tritanium', '00:34:48', '01:50', '19', '00:04:40', '04:37:20', '19.44', '39', '00:05:22', '2:56:51', '8:20', '38', '08:19:00', 'Ironman 70.3 Kraichgau', '2018-06-03');
INSERT INTO RaceResults (Pos,Bib,Naam,Team,Total) VALUES ('32', '30', 'Elsemieke Stokman', 'Triteam Groningen', '01:24:39'),('37', '29', 'Margot Reinders', 'Triteam Groningen', '01:25:53');
INSERT INTO RaceResults (Pos,Bib,Naam,Team,Swim,PosSwim,T1,Bike,PosBike,AfterBike,T2,Run,PosRun,Total) VALUES ('2', '703', 'Bart Smink', 'Triteam Groningen 4', '00:11:28', '5', '00:01:21', '00:29:11', '15', '00:41:58', '00:00:56', '00:18:03', '2', '01:00:57'),('12', '704', 'Dennis Weerdenburg', 'Triteam Groningen 4', '00:14:18', '59', '00:01:36', '00:29:33', '26', '00:45:27', '00:01:06', '00:18:04', '3', '01:04:36'),('37', '701', 'Rick Nevels', 'Triteam Groningen 4', '00:12:46', '20', '00:01:07', '00:30:04', '34', '00:43:56', '00:01:06', '00:23:34', '68', '01:08:35'),('56', '702', 'David van Eekhout', 'Triteam Groningen 4', '00:12:30', '13', '00:01:16', '00:29:19', '19', '00:43:04', '00:01:25', '00:28:00', '96', '01:12:28');
INSERT INTO RaceResults (Pos,Bib,Naam,Team,Swim,PosSwim,T1,Bike,PosBike,AfterBike,T2,Run,PosRun,Total) VALUES ('28', '514', 'Sam Kamminga', 'Triteam Groningen 3', '00:12:53', '37', '00:01:24', '00:28:28', '11', '00:42:44', '00:01:09', '00:21:23', '41', '01:05:15');
INSERT INTO RaceResults (Pos,Bib,Naam,Team,Swim,PosSwim,T1,Bike,PosBike,AfterBike,T2,Run,PosRun,Total,PosCat) VALUES ('18', '101', 'Harm-Jan Stuut', 'Triteam Groningen 2', '00:11:55', '45', '00:01:14', '00:28:02', '9', '00:41:10', '00:00:51', '00:20:00', '25', '01:02:00', '0'),('29', '102', 'Anton Stempher', 'Triteam Groningen 2', '00:11:59', '49', '00:01:09', '00:28:52', '32', '00:41:59', '00:00:50', '00:20:29', '32', '01:03:18', '0');
INSERT INTO RaceResults (Pos,Bib,Naam,Team,Swim,PosSwim,T1,Bike,PosBike,AfterBike,T2,Run,PosRun,Total,PosCat) VALUES ('18', '208', 'Anne Borst', 'Triteam Groningen 3', '00:13:50', '33', '00:01:36', '00:33:19', '26', '00:48:44', '00:01:10', '00:24:33', '19', '01:14:26', '0'),('83', '229', 'Klazina Korver', 'Triteam Groningen 4', '00:13:59', '37', '00:02:04', '00:40:12', '83', '00:56:14', '00:01:43', '00:34:45', '85', '01:32:41', '0');
INSERT INTO RaceResults (Pos,Bib,Naam,Team,Total) VALUES ('1', '2', 'Rutger Duursma', 'Triteam Groningen', '01:13:09'),('6', '4', 'Bram Smit', 'Triteam Groningen', '01:14:47'),('8', '1', 'Jacob Veenstra', 'Triteam Groningen', '01:15:03'),('29', '28', 'Edwin Dasselaar', 'Ferro Mosae - Maastricht', '01:15:54'),('30', '46', 'Jordi Fuhler', 'De Boks - Klazienaveen', '01:15:57');
INSERT INTO RaceResults (Pos,Bib,Cat,PosCat,Naam,Club,Swim,PosSwim,Bike,PosBike,Run,PosRun,Total,Race,RaceDate) VALUES ('80', '411', 'D18+', '10', 'Telma van de Kamp', 'GSTV Tritanium', '25:06', '52', '2:50:09', '92', '1:19:14', '79', '4:34:30', 'TriNatura - La Roche', '2018-05-27');
INSERT INTO RaceResults (Pos,Bib,Naam,Team,Total) VALUES ('32', '30', 'Elsemieke Stokman', 'Triteam Groningen', '01:24:39'),('37', '29', 'Margot Reinders', 'Triteam Groningen', '01:25:53');
INSERT INTO RaceResults (Pos,Bib,Naam,Team,Swim,PosSwim,T1,Bike,PosBike,AfterBike,T2,Run,PosRun,Total) VALUES ('2', '703', 'Bart Smink', 'Triteam Groningen 4', '00:11:28', '5', '00:01:21', '00:29:11', '15', '00:41:58', '00:00:56', '00:18:03', '2', '01:00:57'),('12', '704', 'Dennis Weerdenburg', 'Triteam Groningen 4', '00:14:18', '59', '00:01:36', '00:29:33', '26', '00:45:27', '00:01:06', '00:18:04', '3', '01:04:36'),('37', '701', 'Rick Nevels', 'Triteam Groningen 4', '00:12:46', '20', '00:01:07', '00:30:04', '34', '00:43:56', '00:01:06', '00:23:34', '68', '01:08:35'),('56', '702', 'David van Eekhout', 'Triteam Groningen 4', '00:12:30', '13', '00:01:16', '00:29:19', '19', '00:43:04', '00:01:25', '00:28:00', '96', '01:12:28');
INSERT INTO RaceResults (Pos,Bib,Naam,Team,Swim,PosSwim,T1,Bike,PosBike,AfterBike,T2,Run,PosRun,Total) VALUES ('28', '514', 'Sam Kamminga', 'Triteam Groningen 3', '00:12:53', '37', '00:01:24', '00:28:28', '11', '00:42:44', '00:01:09', '00:21:23', '41', '01:05:15');
INSERT INTO RaceResults (Pos,Bib,Naam,Team,Swim,PosSwim,T1,Bike,PosBike,AfterBike,T2,Run,PosRun,Total,PosCat) VALUES ('18', '101', 'Harm-Jan Stuut', 'Triteam Groningen 2', '00:11:55', '45', '00:01:14', '00:28:02', '9', '00:41:10', '00:00:51', '00:20:00', '25', '01:02:00', '0'),('29', '102', 'Anton Stempher', 'Triteam Groningen 2', '00:11:59', '49', '00:01:09', '00:28:52', '32', '00:41:59', '00:00:50', '00:20:29', '32', '01:03:18', '0');
INSERT INTO RaceResults (Pos,Bib,Naam,Team,Swim,PosSwim,T1,Bike,PosBike,AfterBike,T2,Run,PosRun,Total,PosCat) VALUES ('18', '208', 'Anne Borst', 'Triteam Groningen 3', '00:13:50', '33', '00:01:36', '00:33:19', '26', '00:48:44', '00:01:10', '00:24:33', '19', '01:14:26', '0'),('83', '229', 'Klazina Korver', 'Triteam Groningen 4', '00:13:59', '37', '00:02:04', '00:40:12', '83', '00:56:14', '00:01:43', '00:34:45', '85', '01:32:41', '0');
INSERT INTO RaceResults (Pos,Bib,Naam,Team,Total) VALUES ('1', '2', 'Rutger Duursma', 'Triteam Groningen', '01:13:09'),('6', '4', 'Bram Smit', 'Triteam Groningen', '01:14:47'),('8', '1', 'Jacob Veenstra', 'Triteam Groningen', '01:15:03'),('29', '28', 'Edwin Dasselaar', 'Ferro Mosae - Maastricht', '01:15:54'),('30', '46', 'Jordi Fuhler', 'De Boks - Klazienaveen', '01:15:57');
INSERT INTO RaceResults (Pos,Bib,Naam,Team,Total) VALUES ('55', '7', 'Lydwien Wilbers', 'Triteam Groningen 2', '01:28:02'),('67', '6', 'Marieke van den Brink', 'Triteam Groningen 2', '01:30:28');
INSERT INTO RaceResults (Pos,Bib,Cat,Naam,City,Swim,PosSwim,Bike,PosBike,AfterBike,T2,Run,PosRun,Total) VALUES ('1', '217', 'H', 'Henk-Jan Dolsma', 'Groningen', '00:06:30', '1', '00:26:34', '1', '00:33:04', '00:02:31', '00:18:32', '1', '00:54:06');
INSERT INTO RaceResults (Pos,Bib,Naam,City,Cat,Swim,PosSwim,T1,Bike,PosBike,AfterBike,PosAftBike,T2,Run,PosRun,Total) VALUES ('1', '7', 'Ernst van Bergen', 'Groningen', 'H<40', '00:17:10', '6', '00:00:39', '01:03:20', '5', '01:21:08', '2', '00:00:50', '00:41:53', '4', '02:03:50');
INSERT INTO RaceResults (Pos,Bib,Naam,City,Cat,Swim,PosSwim,T1,Bike,PosBike,AfterBike,PosAftBike,T2,Run,PosRun,Total) VALUES ('1', '102', 'Ingmar Kloek', 'Dedemsvaart', 'H<40', '00:07:21', '2', '00:00:40', '00:32:02', '5', '00:40:02', '1', '00:00:46', '00:19:07', '1', '00:59:54'),('9', '111', 'Constantin Demuth', 'Groningen', 'H<40', '00:10:33', '27', '00:01:05', '00:34:38', '19', '00:46:15', '16', '00:01:06', '00:21:52', '8', '01:09:13');
INSERT INTO RaceResults (Pos,Bib,Cat,Naam,City,Swim,PosSwim,Bike,PosBike,AfterBike,T2,Run,PosRun,Total) VALUES ('1', '217', 'H', 'Henk-Jan Dolsma', 'Groningen', '00:06:30', '1', '00:26:34', '1', '00:33:04', '00:02:31', '00:18:32', '1', '00:54:06');
INSERT INTO RaceResults (Pos,Bib,Cat,PosCat,Naam,Club,Swim,SwimPace,PosSwim,T1,PosT1,Bike,BikePace,PosBike,AfterBike,PosAftBike,T2,PosT2,Run,RunPace,PosRun,Total,Difference,Race,RaceDate) VALUES ('204', '546', 'M25-29', '10', 'Symen de Jong', 'GSTV Tritanium', '00:58:06', '01:32', '7', '00:03:09', '', '06:06:18', '29.49', '10', '', '', '00:04:08', '', '04:10:09', '05:58', '32', '11:21:48', '', 'Ironman Lanzarote', '2018-05-26');
INSERT INTO RaceResults (Pos,Naam,Team,Total) VALUES ('21', 'Janika Ranta-Ylitalo', 'Triteam Groningen', '1:21:24');
INSERT INTO RaceResults (Pos,Naam,Team,Total) VALUES ('4', 'Thijs Wiggers', 'TriCan - Nijmegen', '0:54:25'),('7', 'Rutger Duursma', 'Triteam Groningen', '0:55:34'),('12', 'Jesse Nijboer', 'Triteam Groningen', '0:56:06'),('19', 'Edwin Dasselaar', 'EDOsports - Maastricht', '0:57:45'),('42', 'Maarten Oosterhuis', 'Triteam Groningen', '1:02:21');
INSERT INTO RaceResults (Pos,Naam,Cat,Total) VALUES ('2', 'Jeroen van Schaik', 'M', '0:58:12'),('3', 'Jordi Fuhler', 'M', '0:58:38'),('24', 'Zoë Mens', 'V', '1:12:27'),('28', 'Friederike Rost', 'V', '1:14:55');
INSERT INTO RaceResults (Pos,Bib,Naam,Team,Cat,Swim,T1,Bike,AfterBike,T2,Run,Total) VALUES ('2', '410', 'Rutger Duursma', 'Tritanium - Dikke Tammo's', 'RecH', '00:02:27', '00:01:36', '00:11:38', '00:15:40', '00:01:02', '00:07:40', '00:24:20'),('8', '101', 'Bram Smit', 'Triteam Groningen 2', '2DH', '00:02:45', '00:01:44', '00:11:17', '00:15:45', '00:01:03', '00:08:04', '00:24:51'),('11', '412', 'Jacob Veenstra', 'Tritanium - Dikke Tammo's', 'RecH', '00:02:40', '00:01:43', '00:11:31', '00:15:53', '00:01:10', '00:07:57', '00:24:59'),('33', '103', 'Harm-Jan Stuut', 'Triteam Groningen 2', '2DH', '00:02:52', '00:01:45', '00:11:58', '00:16:33', '00:01:08', '00:08:26', '00:26:07'),('36', '701', 'Bart Smink', 'Triteam Groningen 4', '4D', '00:02:46', '00:01:47', '00:11:41', '00:16:13', '00:01:12', '00:08:48', '00:26:12'),('76', '594', 'Omar Cornelis', 'Rosiir | TTvW Hof van Twente 2 - Goor', '3D', '00:02:48', '00:01:51', '00:12:05', '00:16:42', '00:01:19', '00:09:03', '00:27:04'),('146', '365', 'Ernst van Bergen', 'Tritanium - Tritanic', 'RecH', '00:03:09', '00:01:56', '00:13:04', '00:18:07', '00:01:24', '00:08:50', '00:28:20'),('150', '703', 'Dennis Weerdenburg', 'Triteam Groningen 4', '4D', '00:03:11', '00:02:32', '00:12:31', '00:18:13', '00:01:35', '00:08:35', '00:28:22'),('173', '325', 'Franciska Schutter', 'De FluitendeFlamingo's', 'RecD', '00:03:08', '00:01:54', '00:12:32', '00:17:34', '00:01:17', '00:09:48', '00:28:37'),('193', '327', 'Elsemieke Stokman', 'De FluitendeFlamingo's', 'RecD', '00:03:13', '00:01:50', '00:12:35', '00:17:36', '00:01:19', '00:09:56', '00:28:51'),('228', '326', 'Margot Reinders', 'De FluitendeFlamingo's', 'RecD', '00:03:09', '00:01:54', '00:13:27', '00:18:30', '00:01:16', '00:09:37', '00:29:22'),('236', '514', 'Jens Rasmussen', 'Triteam Groningen 3', '3D', '00:02:52', '00:01:00', '00:13:28', '00:17:20', '00:01:46', '00:10:22', '00:29:27'),('265', '368', 'Bobby Pranger', 'Tritanium - Tritanic', 'RecH', '00:03:45', '', '10:17:01', '00:19:11', '00:01:22', '00:09:31', '00:30:04'),('271', '373', 'Thomas van Belle', 'Tritanium Dikke Vette DSQ', 'RecH', '00:03:09', '00:02:28', '00:13:03', '00:18:38', '00:01:30', '00:10:04', '00:30:10'),('294', '375', 'Hielke Nobel', 'Tritanium Dikke Vette DSQ', 'RecH', '00:02:59', '00:02:37', '00:12:53', '00:18:28', '00:01:55', '00:10:13', '00:30:35'),('304', '374', 'David van Eekhout', 'Tritanium Dikke Vette DSQ', 'RecH', '00:03:04', '00:02:01', '00:12:18', '00:17:21', '00:01:36', '00:11:59', '00:30:56'),('307', '376', 'Bas Schoonbeek', 'Tritanium Dikke Vette DSQ', 'RecH', '00:03:06', '00:02:16', '00:14:01', '00:19:22', '00:01:58', '00:09:44', '00:31:03'),('309', '702', 'Alex Tonks', 'Triteam Groningen 4', '4D', '00:03:00', '00:02:14', '00:13:09', '00:18:22', '00:01:57', '00:10:48', '00:31:06'),('315', '230', 'Anne Borst', 'Triteam Groningen 4', '2DD', '00:03:29', '00:02:08', '00:13:36', '00:19:13', '00:01:29', '00:10:30', '00:31:11'),('327', '367', 'Hessel Beijaard', 'Tritanium - Tritanic', 'RecH', '00:03:21', '00:02:15', '00:14:58', '00:20:33', '00:02:06', '00:08:56', '00:31:34'),('360', '319', 'Anne van Wijngaarden', 'Tritanium - Shaniqua van Heipaal Riedadtlon', 'RecD', '00:03:22', '00:02:37', '00:14:12', '00:20:10', '00:01:31', '00:10:40', '00:32:20'),('362', '206', 'Marieke van den Brink', 'Triteam Groningen 3', '2DD', '00:03:21', '00:02:15', '00:14:06', '00:19:41', '00:01:40', '00:11:04', '00:32:25'),('377', '318', 'Janika Ranta-Ylitalo', 'Tritanium - Shaniqua van Heipaal Riedadtlon', 'RecD', '00:03:26', '00:02:29', '00:14:30', '00:20:24', '00:01:44', '00:10:39', '00:32:47'),('386', '232', 'Anne Wouda', 'Triteam Groningen 4', '2DD', '00:03:37', '00:02:12', '00:14:02', '00:19:50', '00:01:37', '00:11:31', '00:32:56'),('440', '320', 'Leonie Suurmeijer', 'Tritanium - Shaniqua van Heipaal Riedadtlon', 'RecD', '00:03:40', '00:02:29', '00:14:27', '00:20:35', '00:02:10', '00:12:30', '00:35:14'),('458', '317', 'Lisa van Smoorenburg', 'Tritanium - Shaniqua van Heipaal Riedadtlon', 'RecD', '00:03:43', '00:10:56', '00:07:28', '00:22:07', '00:02:02', '00:12:30', '00:36:38'),('461', '231', 'Klazina Korver', 'Triteam Groningen 4', '2DD', '00:03:10', '00:02:39', '00:15:34', '00:21:23', '00:02:04', '00:14:17', '00:37:43');
INSERT INTO RaceResults (Pos,Bib,Naam,Team,Cat,Swim,T1,Bike,AfterBike,T2,Run,Total) VALUES ('6', '410', 'Rutger Duursma', 'Tritanium - Dikke Tammo's', 'RecH', '00:06:34', '00:01:48', '00:28:09', '00:36:30', '00:01:06', '00:18:44', '00:56:19'),('8', '412', 'Jacob Veenstra', 'Tritanium - Dikke Tammo's', 'RecH', '00:06:41', '00:01:44', '00:28:10', '00:36:34', '00:01:14', '00:19:44', '00:57:30'),('12', '702', 'Alex Tonks', 'Triteam Groningen 4', '4D', '00:08:38', '00:02:13', '00:29:26', '00:40:17', '00:02:03', '00:17:09', '00:59:29'),('20', '594', 'Omar Cornelis', 'Rosiir | TTvW Hof van Twente 2 - Goor', '3D', '00:07:49', '00:01:53', '00:30:21', '00:40:01', '00:01:18', '00:19:49', '01:01:08'),('76', '701', 'Bart Smink', 'Triteam Groningen 4', '4D', '00:08:35', '00:02:18', '00:29:43', '00:40:35', '00:01:21', '00:22:12', '01:04:07'),('77', '703', 'Dennis Weerdenburg', 'Triteam Groningen 4', '4D', '', '', '', '', '', '15:10:37', '01:04:07'),('121', '325', 'Franciska Schutter', 'De FluitendeFlamingo's', 'RecD', '00:08:00', '00:01:59', '00:31:06', '00:41:04', '00:01:28', '00:23:20', '01:05:51'),('122', '327', 'Elsemieke Stokman', 'De FluitendeFlamingo's', 'RecD', '00:07:58', '00:01:59', '00:31:09', '00:41:05', '00:01:25', '00:23:22', '01:05:51'),('123', '326', 'Margot Reinders', 'De FluitendeFlamingo's', 'RecD', '00:08:00', '00:01:58', '00:31:14', '00:41:11', '00:01:23', '00:23:18', '01:05:51'),('146', '368', 'Bobby Pranger', 'Tritanium - Tritanic', 'RecH', '00:11:17', '00:02:09', '00:30:12', '00:43:37', '00:01:33', '00:22:04', '01:07:13'),('147', '365', 'Ernst van Bergen', 'Tritanium - Tritanic', 'RecH', '00:11:20', '00:02:06', '00:30:13', '00:43:38', '00:01:37', '00:21:59', '01:07:13'),('224', '367', 'Hessel Beijaard', 'Tritanium - Tritanic', 'RecH', '00:11:15', '00:01:59', '00:37:37', '00:50:51', '00:01:35', '00:20:44', '01:13:09'),('240', '319', 'Anne van Wijngaarden', 'Tritanium - Shaniqua van Heipaal Riedadtlon', 'RecD', '00:09:31', '00:02:34', '00:34:43', '00:46:47', '00:01:56', '00:27:54', '01:16:36'),('241', '318', 'Janika Ranta-Ylitalo', 'Tritanium - Shaniqua van Heipaal Riedadtlon', 'RecD', '00:09:34', '00:02:31', '00:34:45', '00:46:48', '00:01:55', '00:27:54', '01:16:36'),('242', '320', 'Leonie Suurmeijer', 'Tritanium - Shaniqua van Heipaal Riedadtlon', 'RecD', '00:09:34', '00:02:32', '00:34:42', '00:46:47', '00:01:58', '00:27:52', '01:16:36'),('272', '317', 'Lisa van Smoorenburg', 'Tritanium - Shaniqua van Heipaal Riedadtlon', 'RecD', '00:09:32', '00:02:34', '00:34:42', '00:46:46', '00:01:59', '00:32:46', '01:21:30'),('279', '514', 'Jens Rasmussen', 'Triteam Groningen 3', '3D', '00:07:46', '00:02:00', '00:29:16', '00:39:00', '', '', '00:39:00'),('286', '374', 'David van Eekhout', 'Tritanium Dikke Vette DSQ', 'RecH', '00:07:26', '00:02:31', '', '', '', '', '00:22:25'),('287', '376', 'Bas Schoonbeek', 'Tritanium Dikke Vette DSQ', 'RecH', '00:07:30', '00:02:34', '', '', '', '', '00:22:25'),('288', '373', 'Thomas van Belle', 'Tritanium Dikke Vette DSQ', 'RecH', '00:07:28', '00:02:36', '', '', '', '', '00:22:26'),('289', '375', 'Hielke Nobel', 'Tritanium Dikke Vette DSQ', 'RecH', '00:07:29', '00:02:36', '', '', '', '', '00:22:26');
INSERT INTO RaceResults (Bib,Cat,Naam,Team,Run1,#Run1,T1,Bike,PosBike,AfterBike,T2,Run2,PosRun2,Total) VALUES ('18', 'V', 'Marieke van der Zee', 'Triteam Groningen', '0:10:45', '20', '0:00:45', '0:35:33', '13', '0:46:16', '0:00:47', '0:26:15', '28', '1:13:16'),('17', 'V', 'Margot Reinders', 'Triteam Groningen', '0:11:20', '25', '0:00:49', '0:40:12', '28', '0:51:08', '0:01:12', '0:24:56', '25', '1:17:16');
INSERT INTO RaceResults (Bib,Cat,Naam,Team,Run1,#Run1,T1,Bike,PosBike,AfterBike,T2,Run2,PosRun2,Total) VALUES ('14', 'M', 'Joost Somsen', 'Triteam Groningen', '0:08:51', '19', '0:00:40', '0:30:40', '8', '0:39:34', '0:00:37', '0:18:39', '15', '0:58:49'),('15', 'M', 'Bram Smit', 'Triteam Groningen', '0:09:01', '27', '0:00:38', '0:30:46', '12', '0:39:38', '0:00:46', '0:19:07', '23', '0:59:31'),('13', 'M', 'Rutger Duursma', 'Triteam Groningen', '0:08:28', '10', '0:00:35', '0:31:20', '27', '0:39:36', '0:00:46', '0:19:36', '29', '0:59:58'),('56', 'M', 'Thijs Wiggers', 'TriCan - Nijmegen', '0:08:20', '5', '0:00:35', '0:30:35', '3', '0:38:51', '0:00:38', '0:21:48', '48', '1:01:16');
INSERT INTO RaceResults (Bib,Pos,Naam,PosCat,Cat,Swim,T1,Bike,T2,Run,Total) VALUES ('78', '1', 'Rutger Duursma', '1', 'M24', '03:04', '00:47', '16:15', '00:53', '08:05', '29:04'),('74', '7', 'Henk-Jan Dolsma', '5', 'M24', '03:14', '00:53', '16:34', '00:59', '08:58', '30:39'),('61', '8', 'Jacob Veenstra', '6', 'M24', '03:20', '00:57', '17:20', '01:01', '08:22', '31:00'),('77', '10', 'Bram Smit', '8', 'M24', '03:26', '01:02', '16:58', '01:12', '08:43', '31:21'),('244', '148', 'Anne Abbing', '21', 'V20', '04:43', '01:53', '20:25', '04:34', '11:25', '43:00'),('83', '36', 'Elsemieke Stokman', '2', 'V24', '03:51', '00:58', '18:03', '01:07', '10:26', '34:25');
INSERT INTO RaceResults (Pos,Naam,Bib,Swim,Total,Race,RaceDate) VALUES ('3', 'Friederike Rost', '337', '0:08:35', '0:31:45', 'RunnersWorld Zwemloop sprint V', '2018-04-15'),('7', 'Floor Metz', '335', '0:09:51', '0:34:50', 'RunnersWorld Zwemloop sprint V', '2018-04-15'),('8', 'Janika Ranta-Ylitalo', '336', '0:08:12', '0:35:18', 'RunnersWorld Zwemloop sprint V', '2018-04-15'),('15', 'Leonie Suurmeijer', '325', '0:09:23', '0:37:30', 'RunnersWorld Zwemloop sprint V', '2018-04-15');
INSERT INTO RaceResults (Pos,Naam,Bib,Swim,Total) VALUES ('1', 'Joost Somsen', '338', '0:06:30', '0:24:12'),('4', 'Henk-Jan Dolsma', '316', '0:06:27', '0:25:56'),('7', 'Jordi Fuhler', '333', '0:07:20', '0:26:54'),('15', 'Harmen Moes', '347', '0:07:12', '0:31:24');
INSERT INTO RaceResults (Pos,Naam,Team,Bib,Swim,Total) VALUES ('1', 'Thomas van Belle', 'Team Befmf', '352', '0:08:38', '0:28:43'),('1', 'Bas Schoonbeek', 'Team Befmf', '352', '0:08:38', '0:28:43');
INSERT INTO RaceResults (Pos,Naam,Bib,Swim,Total) VALUES ('1', 'Milou Berends', '215', '0:20:08', '1:05:25');
INSERT INTO RaceResults (Pos,Naam,Bib,Swim,Total) VALUES ('11', 'Mart Adema', '212', '0:20:15', '1:05:31');
INSERT INTO RaceResults (Pos,Naam,Total) VALUES ('1', 'Fenna Heijnen', '1:04:16'),('2', 'Marieke van der Zee', '1:05:47'),('3', 'Anne van Wijngaarden', '1:16:04');
INSERT INTO RaceResults (Pos,Naam,Total) VALUES ('1', 'Thijs Wiggers', '53:59'),('2', 'Jesse Nijboer', '54:39'),('3', 'Bram Smit', '55:19'),('4', 'Bart Smink', '58:16'),('5', 'Maarten Oosterhuis', '1:01:26'),('6', 'Jeroen van Schaik', '1:01:56');
INSERT INTO RaceResults (Pos,Naam,Cat,PosCat,Total,Race,RaceDate) VALUES ('8025', 'Mathijs Pieters', 'MSR', '260', '3:05:38', 'Marathon Rotterdam', '2018-04-08'),('1198', 'Jeroen van Schaik', 'MSR', '396', '3:16:07', 'Marathon Rotterdam', '2018-04-08'),('10925', 'Bobby Pranger', 'MSR', '2009', '4:20:33', 'Marathon Rotterdam', '2018-04-08');
INSERT INTO RaceResults (TeamRank,Naam,Run1,PosRun,T1,PosT1,Bike,PosBike,T2,PosT2,Run2,PosRun2,Total,Pos,Race,RaceDate) VALUES ('7', 'Fenna Heijnen', '0:10:38', '14', '0:00:23', '19', '0:33:49', '9', '0:00:21', '12', '0:22:50', '18', '1:08:02', '14', 'RBR Series Geel V', '2018-04-07'),('7', 'Marieke van der Zee', '0:10:35', '13', '0:00:19', '8', '0:33:58', '11', '0:00:19', '7', '0:24:49', '24', '1:10:03', '19', 'RBR Series Geel V', '2018-04-07');
INSERT INTO RaceResults (TeamRank,Naam,Run1,PosRun,T1,PosT1,Bike,PosBike,T2,PosT2,Run2,PosRun2,Total,Pos,Race,RaceDate) VALUES ('1', 'Thijs Wiggers', '0:08:35', '4', '0:00:16', '7', '0:29:42', '22', '0:00:16', '2', '0:18:36', '19', '0:57:26', '18', 'RBR Series Geel M', '2018-04-07'),('7', 'Jesse Nijboer', '0:08:44', '13', '0:00:17', '16', '0:29:36', '16', '0:00:17', '7', '0:17:47', '14', '0:56:43', '14', 'RBR Series Geel M', '2018-04-07'),('7', 'Bram Smit', '0:09:03', '24', '0:00:17', '14', '0:29:15', '5', '0:00:19', '14', '0:18:38', '21', '0:57:33', '19', 'RBR Series Geel M', '2018-04-07'),('7', 'Rutger Duursma', '0:08:44', '12', '0:00:15', '5', '0:29:37', '18', '0:00:17', '6', '0:19:01', '26', '0:57:56', '22', 'RBR Series Geel M', '2018-04-07'),('7', 'Harm-Jan Stuut', '0:09:38', '48', '0:00:20', '42', '0:29:55', '32', '0:00:22', '29', '0:20:43', '50', '1:01:01', '37', 'RBR Series Geel M', '2018-04-07');
INSERT INTO RaceResults (Team,Naam,Run1,#Run1,Bike,PosBike,Run2,PosRun2,Total,Pos,TeamTotal,TeamRank,Race,RaceDate) VALUES ('1', 'Fenna Heijnen', '0:08:56', '7', '0:15:51', '3', '0:03:41', '12', '0:28:28', '5', '1:29:49', '5', 'RBR Series - Oldenzaal V', '2018-03-31'),('3', 'Marieke van der Zee', '0:09:13', '11', '0:16:23', '9', '0:03:38', '10', '0:29:14', '7', '1:29:49', '5', 'RBR Series - Oldenzaal V', '2018-03-31');
INSERT INTO RaceResults (Team,Naam,Run1,#Run1,Bike,PosBike,Run2,PosRun2,Total,Pos,TeamTotal,TeamRank,Race,RaceDate) VALUES ('4', 'Thijs Wiggers', '0:07:25', '12', '0:13:32', '1', '0:02:54', '12', '0:23:51', '3', '1:36:24', '1', 'RBR Series - Oldenzaal', '2018-03-31'),('1', 'Jesse Nijboer', '0:07:24', '10', '0:13:44', '8', '0:02:48', '6', '0:23:56', '5', '1:37:20', '2', 'RBR Series - Oldenzaal', '2018-03-31'),('2', 'Joost Somsen', '0:07:36', '18', '0:13:33', '2', '0:03:07', '29', '0:24:16', '12', '1:37:20', '2', 'RBR Series - Oldenzaal', '2018-03-31'),('3', 'Rutger Duursma', '0:07:32', '15', '0:13:41', '6', '0:03:01', '18', '0:24:14', '11', '1:37:20', '2', 'RBR Series - Oldenzaal', '2018-03-31'),('4', 'Bram Smit', '0:08:00', '40', '0:13:41', '6', '0:03:13', '41', '0:24:54', '26', '1:37:20', '2', 'RBR Series - Oldenzaal', '2018-03-31');
INSERT INTO RaceResults (Pos,Naam,Club,Total,Race,RaceDate) VALUES ('1', 'Joost Somsen', 'TKF 1', '31:34', '24e Haaksbergse Engelse Mijlenloop', '2018-03-25');
INSERT INTO RaceResults (Pos,Naam,Bib,Total,Race,RaceDate) VALUES ('4', 'Bram Smit', '126', '1:06:45.000', 'ICW Middelstum', '2018-03-25'),('34', 'Maarten Oosterhuis', '125', '1:09:57.000', 'ICW Middelstum', '2018-03-25');
INSERT INTO RaceResults (Pos,Naam,Cat,PosCat,Total,Race,RaceDate) VALUES ('700', 'Anne van Wijngaarden', 'SE F', '19', '3:57:56', 'Marathon de Bordeaux', '2018-03-24');
INSERT INTO RaceResults (Pos,Naam,City,Total,Race,RaceDate) VALUES ('4', 'Fenna Heijnen', 'Groningen', '41:23', 'Leekster Lente Loop V 10KM', '2018-03-24');
INSERT INTO RaceResults (Pos,Naam,City,Total,Race,RaceDate) VALUES ('2', 'Bram Smit', 'Noordhorn', '16:52', 'Leekster Lente Loop M 5KM', '2018-03-24');
INSERT INTO RaceResults (Pos,Naam,City,Total,Race,RaceDate) VALUES ('4', 'Harm Jan Stuut', 'Groningen', '1:21:39', 'Leekster Lente Loop M 21.1KM', '2018-03-24');
INSERT INTO RaceResults (Pos,Naam,City,Total,Race,RaceDate) VALUES ('13', 'Maarten Oosterhuis', 'Groningen', '38:08', 'Leekster Lente Loop M 10KM', '2018-03-24'),('20', 'Jos Wilbrink', 'Groningen', '39:49', 'Leekster Lente Loop M 10KM', '2018-03-24');
INSERT INTO RaceResults (Pos,Naam,City,Total,Race,RaceDate) VALUES ('3', 'Marieke van der Zee', 'Groningen', '20:39', 'Leekster Lente Loop V 5KM', '2018-03-24');
INSERT INTO RaceResults (Pos,Bib,Naam,PosCat,Cat,Club,Team,Total,Difference,PosSwim,PosT1,Race,RaceDate) VALUES ('132', '128', 'Symen de Jong', '4', 'GGEE-27', 'G.S.T.V. TRITANIUM', 'G.S.T.V. TRITANIUM', '04:52:52', '01:20:12', '9', '5', 'Ocean Lava TriSantaCruz Tenerife 2018', '2018-03-04');
INSERT INTO RaceResults (Pos,Bib,Naam,City,Cat,Run1,T1,Bike,PosBike,AfterBike,T2,Run2,Total,Race,RaceDate) VALUES ('14', '60', 'Thijs Wiggers', 'GRONINGEN', 'H20+', '00:36:46', '00:00:39', '01:00:33', '13', '01:37:57', '00:00:41', '00:18:34', '01:57:11', 'NK Run Bike Run ', '2017-10-08'),('23', '57', 'Jesse Nijboer', 'GRONINGEN', 'H20+', '00:35:48', '00:00:52', '01:03:51', '34', '01:40:30', '00:00:45', '00:18:34', '01:59:48', 'NK Run Bike Run ', '2017-10-08'),('24', '58', 'Bram Smit', 'NOORDHORN', 'H20+', '00:37:47', '00:00:44', '01:00:24', '11', '01:38:54', '00:00:44', '00:20:25', '02:00:02', 'NK Run Bike Run ', '2017-10-08');
INSERT INTO RaceResults (Pos,Bib,Naam,City,Run1,T1,Bike,AfterBike,T2,Run2,Total,Race,RaceDate) VALUES ('2', '210', 'Joost Somsen', 'EIBERGEN', '00:17:45', '00:00:39', '00:29:37', '00:48:00', '00:00:40', '00:08:51', '00:57:31', 'NK Run Bike Run ', '2017-10-08');
INSERT INTO RaceResults (Pos,Bib,Cat,PosCat,Naam,Club,Swim,SwimPace,PosSwim,T1,PosT1,Bike,BikePace,PosBike,AfterBike,PosAftBike,T2,PosT2,Run,RunPace,PosRun,Total,Difference,Race,RaceDate) VALUES ('19', '', 'M', '19', 'Jens Rasmussen', 'GSTV Tritanium', '', '', '', '', '', '03:31:01', '"39', '28"', '54:23', '"38', '00"', '', '', '', '', '', '', '', ''),('71', '', 'V', '5', 'Sandra van Diemen', '', '', '', '', '', '', '04:14:07', '"32', '98"', '01:04:02', '"32', '27"', '', '', '', '', '', '', '', '');
INSERT INTO RaceResults (Pos,Bib,Naam,City,Cat,PosCat,Total,Race,RaceDate) VALUES ('45', '316', 'Lydwien Wilbers', 'Groningen', 'V', '6', '00:24:09', 'BurgumRun ', '2017-09-10');
INSERT INTO RaceResults (Pos,Bib,Naam,Cat,PosCat,Total,Race,RaceDate) VALUES ('252', '672', 'Sytze Hoekstra', 'M', '168', '01:14:54', 'BurgumRun ', '2017-09-10');
INSERT INTO RaceResults (Pos,Bib,Naam,Team,Swim,T1,Bike,AfterBike,T2,Run,Total,Race,RaceDate) VALUES ('4', '133', 'Jens Rasmussen', 'Triteam Groningen 3', '00:07:22', '00:01:11', '00:28:14', '00:36:46', '00:02:13', '00:24:03', '01:03:00', 'Triathlon Vroomshoop ', '2017-09-09');
INSERT INTO RaceResults (Pos,Bib,Naam,Team,Swim,T1,Bike,AfterBike,T2,Run,Total,Race,RaceDate) VALUES ('2', '205', 'Lydwien Wilbers', 'Triteam Groningen 3', '00:07:18', '00:01:31', '00:31:26', '00:40:15', '00:02:11', '00:24:12', '01:06:37', 'Triathlon Vroomshoop ', '2017-09-09'),('22', '275', 'Anne Borst', 'Triteam Groningen 4', '00:08:13', '00:01:41', '00:32:41', '00:42:34', '00:02:19', '00:25:50', '01:10:43', 'Triathlon Vroomshoop ', '2017-09-09'),('56', '276', 'Anne Wouda', 'Triteam Groningen 4', '00:08:13', '00:01:40', '00:32:43', '00:42:35', '00:02:21', '00:30:14', '01:15:10', 'Triathlon Vroomshoop ', '2017-09-09'),('85', '207', 'Nienke Kienstra', 'Triteam Groningen 3', '00:06:13', '00:02:33', '00:31:30', '00:40:15', '00:02:09', '', '00:42:24', 'Triathlon Vroomshoop ', '2017-09-09');
INSERT INTO RaceResults (Pos,Bib,Naam,City,Cat,Swim,PosSwim,T1,Bike,PosBike,AfterBike,PosAftBike,T2,Run,PosRun,Total,Race,RaceDate) VALUES ('20', '302', 'Thomas van Belle', 'GRONINGEN', 'H-40', '00:17:42', '17', '00:02:10', '01:16:22', '34', '01:36:13', '18', '00:02:14', '00:49:00', '30', '02:27:26', 'Triathlon Apeldoorn ', '2017-09-09');
INSERT INTO RaceResults (Pos,Bib,Naam,City,Cat,Swim,PosSwim,PosBike,AfterBike,PosAftBike,T2,Run,PosRun,Total,Race,RaceDate) VALUES ('8', '596', 'Telma van de Kamp', 'Nes-Ameland', 'D20', '00:10:26', '13', '14', '01:29:58', '10', '00:01:03', '00:33:08', '13', '02:04:08', '16e Tri-Ambla Cross Triathlon Ameland 09-09-2017', '2017-09-09');
INSERT INTO RaceResults (Pos,Bib,Naam,City,Cat,Swim,PosSwim,Bike,PosBike,AfterBike,PosAftBike,Run,PosRun,Total,Race,RaceDate) VALUES ('16', '17', 'Jacob Veenstra', 'Groningen', 'Meli', '', '0', '', '0', '', '0', '03:13:21', '34', '08:47:14', '2017 ETU CHALLENGEALMERE-AMSTERDAM Long Distance Triathlon European Championships   09-09-2017', '2017-09-09');
INSERT INTO RaceResults (Pos,Bib,Naam,City,Cat,Swim,PosSwim,Bike,PosBike,AfterBike,PosAftBike,Run1,Run2,Run,PosRun,Total,Race,RaceDate) VALUES ('389', '2005', 'Marieke de Graaf', 'Groningen', 'WU24', '00:40:49', '628', '02:53:40', '574', '03:41:27', '579', '00:32:23', '00:34:37', '01:42:53', '216', '05:29:42', '2017 ETU CHALLENGEALMERE-AMSTERDAM Long Distance Triathlon European Championships   09-09-2017', '2017-09-09'),('661', '1207', 'Thijs de Roo', 'Zwolle', 'M30', '00:37:25', '444', '03:01:18', '721', '03:45:11', '653', '00:40:13', '00:41:31', '02:04:30', '697', '05:54:43', '2017 ETU CHALLENGEALMERE-AMSTERDAM Long Distance Triathlon European Championships   09-09-2017', '2017-09-09'),('750', '1018', 'David van Eekhout', 'Ede Gld', 'MU24', '00:34:10', '207', '02:55:19', '630', '03:36:44', '504', '00:42:21', '00:48:10', '02:21:38', '896', '06:05:59', '2017 ETU CHALLENGEALMERE-AMSTERDAM Long Distance Triathlon European Championships   09-09-2017', '2017-09-09'),('939', '2023', 'Klazina Korver', 'Groningen', 'W25', '00:36:45', '388', '03:18:44', '899', '04:01:55', '835', '00:51:02', '00:53:11', '02:43:54', '972', '06:50:02', '2017 ETU CHALLENGEALMERE-AMSTERDAM Long Distance Triathlon European Championships   09-09-2017', '2017-09-09');
INSERT INTO RaceResults (Pos,Bib,Cat,Naam,City,Swim,PosSwim,T1,PosT1,Bike,PosBike,AfterBike,Run,PosRun,Total,Race,RaceDate) VALUES ('14', '542', 'H16+', 'Joost Somsen', 'EIBERGEN', '00:12:21', '32', '00:01:05', '8', '00:31:00', '15', '00:44:25', '00:16:39', '6', '01:01:03', 'Rutbeek Triathlon Enschede 03-09-2017', '2017-09-03');
INSERT INTO RaceResults (Pos,Bib,Naam,City,Cat,Swim,PosSwim,T1,Bike,PosBike,AfterBike,PosAftBike,T2,Run,PosRun,Total,Race,RaceDate) VALUES ('100', '703', 'José van der Waa', 'ZWOLLE', 'D14+', '00:14:02', '110', '00:02:12', '00:39:03', '147', '00:55:16', '113', '00:01:40', '00:26:11', '107', '01:23:06', 'Triathlon Zwolle ', '2017-09-02');
INSERT INTO RaceResults (Pos,Bib,Cat,Naam,City,Swim,PosSwim,T1,PosT1,Bike,PosBike,AfterBike,PosAftBike,T2,PosT2,Run,PosRun,Total,Race,RaceDate) VALUES ('37', '50', 'NK_Hneo', 'Joost Somsen', 'Rosiir - Tjellens / TTvW Hof van Twente - Goor', '00:11:47', '73', '00:00:47', '12', '00:27:12', '54', '00:39:45', '69', '00:00:52', '36', '00:16:33', '21', '00:57:09', '35e van Dijk Triatlon Veenendaal   26-08-2017', '2017-08-26'),('43', '66', 'NK_H', 'Rutger Duursma', 'Triteam Groningen', '00:11:08', '63', '00:00:51', '44', '00:27:19', '59', '00:39:17', '53', '00:00:48', '13', '00:17:21', '53', '00:57:26', '35e van Dijk Triatlon Veenendaal   26-08-2017', '2017-08-26'),('54', '70', 'NK_H', 'Jacob Veenstra', 'Triteam Groningen', '00:11:06', '62', '00:00:52', '58', '00:27:22', '63', '00:39:20', '59', '00:00:55', '52', '00:17:44', '63', '00:57:58', '35e van Dijk Triatlon Veenendaal   26-08-2017', '2017-08-26'),('58', '69', 'NK_H', 'Anton Stempher', 'Triteam Groningen', '00:12:03', '83', '00:00:54', '68', '00:26:48', '28', '00:39:44', '64', '00:00:51', '28', '00:17:36', '61', '00:58:10', '35e van Dijk Triatlon Veenendaal   26-08-2017', '2017-08-26');
INSERT INTO RaceResults (Pos,Bib,Cat,Naam,City,Swim,PosSwim,T1,PosT1,Bike,PosBike,AfterBike,PosAftBike,T2,PosT2,Run,PosRun,Total,Race,RaceDate) VALUES ('43', '135', 'NK_Dneo', 'Margot Reinders', 'Triteam Groningen', '00:13:37', '47', '00:01:00', '34', '00:32:29', '42', '00:47:06', '45', '00:01:52', '32', '00:21:06', '37', '01:10:03', '35e van Dijk Triatlon Veenendaal   26-08-2017', '2017-08-26');
INSERT INTO RaceResults (Pos,Bib,Cat,Naam,City,Swim,PosSwim,T1,PosT1,Bike,PosBike,AfterBike,PosAftBike,T2,PosT2,Run,PosRun,Total,Race,RaceDate) VALUES ('107', '779', 'K_H20', 'David van Eekhout', 'GRONINGEN', '00:17:15', '34', '00:02:12', '95', '01:03:14', '44', '01:22:40', '29', '00:03:11', '158', '00:55:12', '202', '02:21:02', '35e van Dijk Triatlon Veenendaal   26-08-2017', '2017-08-26');
INSERT INTO RaceResults (Pos,Bib,Cat,PosCat,Naam,Club,Swim,SwimPace,PosSwim,T1,PosT1,Bike,BikePace,PosBike,AfterBike,PosAftBike,T2,PosT2,Run,RunPace,PosRun,Total,Difference,Race,RaceDate) VALUES ('38', '472', 'D25-29', '12', 'Franciska Schutter', 'GSTV Tritanium', '01:02:45', '01:37', '10', '00:03:42', '', '05:29:44', '32.80', '8', '06:36:11', '', '00:03:31', '', '04:01:00', '05:42', '12', '10:40:42', '', 'Ironman Copenhagen', '2017-08-20');
INSERT INTO RaceResults (Pos,Bib,Naam,City,Cat,Swim,PosSwim,T1,Bike,PosBike,AfterBike,PosAftBike,T2,Run,PosRun,Total,Race,RaceDate) VALUES ('193', '302', 'Klazina Korver', 'Groningen', 'DS', '00:19:29', '50', '00:02:31', '01:30:15', '200', '01:52:14', '178', '00:01:10', '01:09:35', '197', '03:02:58', 'Kwart(je) & Trio Triathlon Anna Paulowna   19-08-2017', '2017-08-19');
INSERT INTO RaceResults (Pos,Bib,Cat,PosCat,Naam,Club,Swim,PosSwim,T1,PosT1,Bike,PosBike,AfterBike,PosAftBike,T2,PosT2,Run,PosRun,Total,Difference,Race,RaceDate) VALUES ('138', '770', 'M30-34', '26', 'Harm-Jan Stuut', '', '01:04:01', '39', '04:22:00', '', '05:21:30', '32', '06:29:53', '', '03:18:00', '', '03:42:08', '29', '10:15:19', '', 'Ironman Maastricht', '2017-08-06');
INSERT INTO RaceResults (Pos,Bib,Naam,City,Cat,PosCat,Swim,Race,RaceDate) VALUES ('298', '580', 'Mirte Huisman', 'GRONINGEN', 'V', '107', '00:11:42.05', '6e Het Rondje Eilanden Vinkeveen 29-07-2017', '2017-07-29');
INSERT INTO RaceResults (Pos,Bib,Naam,City,Cat,PosCat,Total,Race,RaceDate) VALUES ('382', '580', 'Mirte Huisman', 'GRONINGEN', 'V', '134', '01:06:19', '6e Het Rondje Eilanden Vinkeveen 29-07-2017', '2017-07-29');
INSERT INTO RaceResults (Pos,Bib,Naam,City,Cat,PosCat,Run,Race,RaceDate) VALUES ('492', '580', 'Mirte Huisman', 'GRONINGEN', 'V', '191', '00:03:48.90', '6e Het Rondje Eilanden Vinkeveen 29-07-2017', '2017-07-29');
INSERT INTO RaceResults (Pos,Bib,Naam,City,Cat,Race,RaceDate) VALUES ('134', '580', 'Mirte Huisman', 'GRONINGEN', 'V', '6e Het Rondje Eilanden Vinkeveen 29-07-2017', '2017-07-29');
INSERT INTO RaceResults (Pos,Naam,City,Total,Race,RaceDate) VALUES ('16', 'Bram Smit', 'Noordhorn', '1:31:57', 'Ulrum Halve Marathon', '2017-07-29'),('30', 'Emiel Harder', 'Groningen', '1:43:52', 'Ulrum Halve Marathon', '2017-07-29');
INSERT INTO RaceResults (Pos,Bib,Cat,PosCat,Naam,Club,Swim,PosSwim,T1,PosT1,Bike,PosBike,AfterBike,PosAftBike,T2,PosT2,Run,PosRun,Total,Difference,Race,RaceDate) VALUES ('17', '929', 'Senior 1 D', '17', 'Tess Bosch', 'GSTV Tritanium', '00:24:34', '', '00:03:42', '', '02:07:16', '18', '', '', '00:01:55', '', '00:51:04', '20', '03:28:32', '', 'Triathlon Alpe D'Huez', '2017-07-28');
INSERT INTO RaceResults (Pos,Bib,Naam,City,Cat,Swim,PosSwim,T1,PosT1,Bike,PosBike,AfterBike,PosAftBike,T2,PosT2,Run,PosRun,Total,Race,RaceDate) VALUES ('109', '683', 'Klazina Korver', 'Groningen', 'V', '00:28:00', '46', '00:03:03', '64', '01:37:43', '112', '02:08:45', '93', '00:01:58', '50', '01:15:08', '115', '03:25:50', '11e Plus Fischer Triathlon Klazienaveen 16-07-2017', '2017-07-16');
INSERT INTO RaceResults (Pos,Bib,Naam,City,Cat,Swim,PosSwim,T1,PosT1,Bike,PosBike,AfterBike,PosAftBike,T2,PosT2,Run,PosRun,Total,Race,RaceDate) VALUES ('9', '1074', 'Jordi Fuhler', 'Klazienaveen', 'H14+', '00:07:42', '9', '00:01:51', '11', '00:37:21', '11', '00:46:54', '8', '00:01:13', '10', '00:22:03', '12', '01:10:09', '11e Plus Fischer Triathlon Klazienaveen 16-07-2017', '2017-07-16'),('44', '1247', 'Milou Berends', 'Deventer', 'D14+', '00:11:59', '145', '00:02:52', '79', '00:41:11', '45', '00:56:01', '58', '00:02:12', '120', '00:23:24', '21', '01:21:36', '11e Plus Fischer Triathlon Klazienaveen 16-07-2017', '2017-07-16'),('56', '1022', 'Maurice Wessels', 'Groningen', 'M', '00:10:45', '98', '00:05:17', '185', '00:41:36', '49', '00:57:37', '86', '00:02:41', '165', '00:23:55', '28', '01:24:13', '11e Plus Fischer Triathlon Klazienaveen 16-07-2017', '2017-07-16');
INSERT INTO RaceResults (Pos,Bib,Naam,City,PosCat,Cat,Swim,PosSwim,T1,Bike,PosBike,AfterBike,PosAftBike,T2,Run,PosRun,Total,Race,RaceDate) VALUES ('2', '204', 'Joost Somsen', 'EIBERGEN', '2', 'H16+', '00:07:58', '6', '00:00:53', '00:32:18', '1', '00:41:08', '2', '00:00:50', '00:19:04', '2', '01:01:01', 'Dion Triathlon ', '2017-07-08');
INSERT INTO RaceResults (Pos,Bib,Naam,City,PosCat,Cat,Swim,PosSwim,T1,Bike,PosBike,AfterBike,PosAftBike,T2,Run,PosRun,Total,Race,RaceDate) VALUES ('24', '20', 'Ingmar Kloek', 'GRONINGEN', '13', 'H16+', '00:17:54', '12', '00:01:05', '01:09:03', '69', '01:28:01', '40', '00:01:01', '00:44:31', '10', '02:13:33', 'Dion Triathlon ', '2017-07-08'),('73', '148', 'Thijs de Roo', 'ZWOLLE', '32', 'H16+', '00:19:45', '41', '00:01:14', '01:12:58', '102', '01:33:56', '76', '00:01:40', '00:56:32', '81', '02:32:06', 'Dion Triathlon ', '2017-07-08');
INSERT INTO RaceResults (Pos,Bib,Naam,Cat,Total,Swim,T1,Bike,T2,Race,RaceDate) VALUES ('2', '45', 'Jacob Veenstra', 'MAN', '8:57:02', '1:00:24', '0:02:58', '4:40:20', '0:01:02', 'Frysman 2017', '2017-07-08');
INSERT INTO RaceResults (Pos,Bib,Naam,Cat,Total,Swim,T1,Bike,T2) VALUES ('2', '45', 'Jacob Veenstra', '2', 'MAN', '8:57:02', '1:00:24', '0:02:58', '4:40:20');
INSERT INTO RaceResults (Pos,Bib,Naam,City,Cat,PosCat,Total,BikePace,Race,RaceDate) VALUES ('9', '544', 'Karst Venema', 'Groningen', 'M', '9', '00:13:31.439', '"26', '62"', 'Sallands Mooiste '),('365', '299', 'Sam Kamminga', 'Groningen', 'M', '352', '00:17:16.324', '"20', '84"', 'Sallands Mooiste ');
INSERT INTO RaceResults (Pos,Bib,Naam,City,Afstand,Cat,PosCat,Total,BikePace,Race,RaceDate) VALUES ('9', '544', 'Karst Venema', 'Groningen', '80', 'M', '9', '13:31.4', '"26', '62"', 'Sallands mooiste'),('365', '299', 'Sam Kamminga', 'Groningen', '80', 'M', '352', '17:16.3', '"20', '84"', 'Sallands mooiste');
INSERT INTO RaceResults (Bib,Naam,City,Cat,Total,Pos,Bike,BikePace,Race,RaceDate) VALUES ('299', 'Sam Kamminga', 'Groningen', 'M', '4:45:40', '365', '17:16', '"20', '84"', 'Sallands mooiste'),('367', 'Hilde van Loo', 'Groningen', 'V', '4:31:50', '0', '', '', 'Sallands mooiste', '2017-07-02'),('544', 'Karst Venema', 'Groningen', 'M', '4:45:37', '9', '13:31', '"26', '62"', 'Sallands mooiste');
INSERT INTO RaceResults (Pos,Bib,Cat,Naam,City,Swim,PosSwim,T1,Bike,PosBike,AfterBike,T2,Run,PosRun,Total,Race,RaceDate) VALUES ('8', '264', 'H18+', 'Jordi Fuhler', 'KLAZIENAVEEN', '00:13:56', '19', '00:00:54', '00:35:09', '11', '00:49:58', '00:00:37', '00:20:24', '8', '01:10:58', 'Triathlon Friesland ', '2017-07-01'),('35', '421', 'D20+', 'Lydwien Wilbers', 'GRONINGEN', '00:13:58', '21', '00:00:52', '00:40:48', '68', '00:55:38', '00:00:47', '00:23:14', '36', '01:19:38', 'Triathlon Friesland ', '2017-07-01'),('50', '466', 'D20+', 'Telma van de Kamp', 'Groningen', '00:15:31', '40', '00:01:42', '00:41:55', '77', '00:59:07', '00:01:33', '00:23:27', '41', '01:24:06', 'Triathlon Friesland ', '2017-07-01'),('74', '432', 'D20+', 'Anne Wouda', 'GRONINGEN', '00:15:44', '43', '00:01:36', '00:42:32', '79', '00:59:52', '00:01:15', '00:28:02', '94', '01:29:09', 'Triathlon Friesland ', '2017-07-01'),('117', '412', 'D20+', 'Klazina Korver', 'GRONINGEN', '00:15:22', '35', '00:01:27', '00:43:42', '95', '01:00:30', '00:01:20', '00:33:32', '143', '01:35:20', 'Triathlon Friesland ', '2017-07-01');
INSERT INTO RaceResults (Pos,Bib,Cat,Naam,City,Swim,PosSwim,T1,Bike,PosBike,AfterBike,T2,Run,PosRun,Total,Race,RaceDate) VALUES ('4', '756', 'H30+', 'Jacob Veenstra', 'GRONINGEN', '00:28:04', '4', '00:01:08', '01:03:43', '3', '01:32:54', '00:01:18', '00:40:10', '7', '02:14:21', 'Triathlon Friesland ', '2017-07-01'),('32', '706', 'H20+', 'Symen de Jong', 'GIEKERK', '00:28:26', '5', '00:00:42', '01:14:47', '44', '01:43:53', '00:00:40', '00:47:49', '42', '02:32:21', 'Triathlon Friesland ', '2017-07-01');
INSERT INTO RaceResults (Pos,Bib,Cat,Naam,City,Swim,PosSwim,T1,PosAftT1,Bike,PosBike,AfterBike,PosAftBike,T2,PosAftT2,Run,PosRun,Total,Race,RaceDate) VALUES ('198', '2050', 'Heren 18', 'Thijs de Roo', 'Zwolle', '00:29:37', '190', '00:01:51', '00:31:28', '01:25:20', '242', '01:56:48', '209', '00:02:18', '01:59:06', '00:56:21', '201', '02:55:27', '2017 Holten ETU Premium Sprint Cup & ETU Junior European Cup 01-07-2017', '2017-07-01');
INSERT INTO RaceResults (Pos,Bib,Cat,Naam,Run1,T1,Bike,PosBike,AfterBike,T2,Run2,PosRun2,Total,Race,RaceDate) VALUES ('1', '31', 'Man 40-', 'Thijs Wiggers', '00:24:44', '00:00:40', '00:43:53', '2', '01:09:17', '00:00:22', '00:13:36', '7', '01:23:13', 'Run Bike Run Deurningen 25-06-2017', '2017-06-25');
INSERT INTO RaceResults (Pos,Bib,Cat,Naam,City,Swim,T1,Bike,AfterBike,T2,Run1,Run2,Run,Race,RaceDate) VALUES ('1', '371', 'H24', 'Rutger Duursma', 'Groningen', '00:21:41', '00:00:26', '01:02:14', '01:24:20', '00:00:22', '00:09:20', '00:09:45', '00:38:02', '5e Zeewolde Endurance Triathlon   24-06-2017', '2017-06-24'),('11', '421', 'H24', 'Jos Wilbrink', 'Groningen', '00:27:58', '00:00:52', '01:06:07', '01:34:57', '00:01:03', '00:10:47', '00:10:41', '00:43:05', '5e Zeewolde Endurance Triathlon   24-06-2017', '2017-06-24');
INSERT INTO RaceResults (Pos,Bib,Cat,Naam,City,Swim,PosSwim,T1,PosT1,Bike,PosBike,AfterBike,PosAftBike,T2,PosT2,Run,PosRun,Total,Difference,Race,RaceDate) VALUES ('1', '371', 'H24', 'Rutger Duursma', 'Groningen', '00:21:41', '1', '00:00:26', '1', '01:02:14', '2', '01:24:20', '2', '00:00:22', '1', '00:38:02', '1', '02:02:43', '', '5e Zeewolde Endurance Triathlon   24-06-2017', '2017-06-24'),('11', '421', 'H24', 'Jos Wilbrink', 'Groningen', '00:27:58', '27', '00:00:52', '24', '01:06:07', '11', '01:34:57', '15', '00:01:03', '41', '00:43:05', '16', '02:19:04', '00:16:21', '5e Zeewolde Endurance Triathlon   24-06-2017', '2017-06-24');
INSERT INTO RaceResults (Pos,Bib,Cat,Naam,City,Swim,PosSwim,T1,PosT1,Bike,PosBike,AfterBike,PosAftBike,T2,PosT2,Run,PosRun,Total,Difference,Race,RaceDate) VALUES ('2', '125', 'J16+', 'Joost Somsen', 'Eibergen', '00:12:12', '15', '00:00:31', '2', '00:31:14', '2', '00:43:56', '2', '00:00:37', '11', '00:17:59', '2', '01:02:31', '00:01:58', '5e Zeewolde Endurance Triathlon   24-06-2017', '2017-06-24');
INSERT INTO RaceResults (Pos,Bib,Naam,City,Cat,Swim,PosSwim,T1,Bike,PosBike,AfterBike,PosAftBike,T2,Run,PosRun,Total,Race,RaceDate) VALUES ('2', '256', 'Joost Somsen', 'EIBERGEN', 'H18+', '00:08:19', '5', '00:01:23', '00:33:00', '3', '00:42:41', '2', '00:00:45', '00:19:12', '3', '01:02:37', '2e GUV Triathlon Aalten ', '2017-06-18');
INSERT INTO RaceResults (Pos,Bib,Naam,Swim,PosSwim,T1,PosT1,Bike,PosBike,T2,PosT2,Run,PosRun,Total,Race,RaceDate) VALUES ('5', '176', 'Harm-Jan Stuut', '0:15:16', '10', '0:00:51', '7', '0:39:27', '5', '', '', '', '', '2:01:35', 'Speedman Kwart M', '2017-06-18'),('7', '133', 'Sam Kamminga', '0:15:19', '12', '0:01:13', '26', '0:40:58', '11', '', '', '', '', '2:03:20', 'Speedman Kwart M', '2017-06-18'),('28', '132', 'Symen de Jong', '0:14:02', '3', '0:00:52', '8', '1:08:59', '9', '0:00:39', '4', '0:49:34', '45', '2:14:04', '', '2017-06-18'),('34', '141', 'Bart Wolters', '0:18:07', '41', '0:01:21', '36', '0:50:25', '51', '', '', '', '', '2:17:08', '', '2017-06-18'),('86', '169', 'Tijs van Slooten', '0:20:18', '64', '0:05:45', '96', '1:16:49', '41', '0:03:11', '64', '1:03:16', '88', '2:49:17', '', '2017-06-18');
INSERT INTO RaceResults (Pos,Bib,Naam,Swim,PosSwim,T1,PosT1,Bike,PosBike,T2,PosT2,Run,PosRun,Total,Race,RaceDate) VALUES ('1', '166', 'Franciska Schutter', '0:15:31', '1', '0:00:41', '1', '0:44:19', '1', '', '', '', '1', '2:07:54', 'Speedman Kwart D', '2016-06-18');
INSERT INTO RaceResults (Pos,Bib,Naam,Cat,Swim,PosSwim,T1,PosT1,Bike,PosBike,T2,PosT2,Run,PosRun,Total,Race,RaceDate) VALUES ('3', '363', 'Thijs Wiggers', 'H20+', '0:07:58', '4', '0:00:36', '1', '0:33:15', '1', '0:00:29', '1', '0:15:44', '4', '0:58:31', 'Speedman Kwart D', '2016-06-18'),('4', '359', 'Jesse Nijboer', 'H24+', '0:08:00', '5', '0:00:53', '5', '0:34:18', '5', '0:00:36', '7', '0:15:23', '2', '0:59:38', 'Speedman Kwart D', '2016-06-18'),('6', '342', 'Ernst van Bergen', 'H20+', '0:08:14', '8', '0:00:38', '2', '0:37:20', '7', '0:00:53', '17', '0:17:11', '8', '1:04:44', '', '2016-06-18'),('7', '341', 'Thomas van Belle', 'H20+', '0:08:00', '6', '0:01:27', '13', '0:37:42', '8', '0:00:50', '14', '0:17:37', '9', '1:06:04', '', '2016-06-18'),('21', '421', 'Luuk Adema', 'HIS', '0:11:01', '34', '0:02:47', '36', '0:44:34', '38', '0:00:33', '3', '0:17:40', '10', '1:17:03', '', '2016-06-18');
INSERT INTO RaceResults (Pos,Bib,Naam,Cat,Swim,PosSwim,T1,PosT1,Bike,PosBike,T2,PosT2,Run,PosRun,Total,Race,RaceDate) VALUES ('3', '350', 'Fenna Heijnen', 'D20+', '0:07:11', '2', '0:00:41', '2', '0:38:50', '3', '0:00:40', '6', '0:18:25', '12', '1:06:15', 'Speedman Kwart D', '2016-06-18'),('4', '360', 'Lilian van Stratum', 'D25+', '0:08:04', '4', '0:00:35', '1', '0:39:34', '4', '0:00:36', '1', '0:20:55', '14', '1:10:13', 'Speedman Kwart D', '2016-06-18'),('5', '362', 'Marieke van der Zee', 'D25+', '0:08:42', '8', '0:01:03', '5', '0:39:40', '5', '0:21:46', '1', '', '', '1:11:11', '', '2016-06-18'),('6', '355', 'Telma van de Kamp', 'D20+', '0:08:33', '7', '0:01:20', '9', '0:42:03', '7', '0:23:14', '5', '', '', '1:15:10', '', '2016-06-18'),('18', '356', 'Klazina Korver', 'D25+', '0:08:22', '6', '0:01:10', '6', '0:44:38', '12', '0:30:45', '9', '', '', '1:24:55', '', '2016-06-18');
INSERT INTO RaceResults (Pos,Bib,Naam,Cat,Swim,PosSwim,T1,PosT1,Bike,PosBike,T2,PosT2,Run,PosRun,Total,Race,RaceDate) VALUES ('1', '293', 'Anton Stempher', 'H35+', '0:06:57', '3', '0:00:41', '1', '0:34:22', '1', '0:00:32', '5', '0:16:04', '1', '0:58:34', 'Speedman achtste M', '2017-06-18'),('8', '251', 'Jordi Fuhler', 'H18+', '0:07:35', '6', '0:00:45', '4', '0:36:57', '13', '0:00:35', '6', '0:19:59', '15', '1:05:50', 'Speedman achtste M', '2017-06-18');
INSERT INTO RaceResults (Pos,Bib,Naam,Swim,PosSwim,T1,PosT1,Bike,PosBike,T2,PosT2,Run,PosRun,Total,Race,RaceDate) VALUES ('58', '565', 'Ruben Dalfsen', '0:23:28', '16', '0:00:43', '4', '1:07:27', '25', '0:58:19', '', '', '', '2:29:57', 'Speedman 3eDiv OD M', '2017-06-18'),('72', '568', 'Rick Nevels', '0:25:34', '46', '0:00:57', '25', '1:13:08', '63', '0:01:12', '17', '0:55:26', '', '2:36:15', 'Speedman 3eDiv OD M', '2017-06-18'),('75', '567', 'Alex Tonks', '0:26:09', '49', '0:01:03', '35', '', '', '', '', '', '', '2:37:53', 'Speedman 3eDiv OD M', '2017-06-18');
INSERT INTO RaceResults (Pos,Bib,Naam,City,PosCat,Cat,Swim,PosSwim,T1,Bike,PosBike,AfterBike,PosAftBike,T2,Run,PosRun,Total,Race,RaceDate) VALUES ('1', '513', 'Joost Somsen', 'EIBERGEN', '1', 'H14+', '00:07:06', '4', '00:00:45', '00:28:58', '1', '00:36:48', '1', '00:00:30', '00:17:52', '3', '00:55:09', '25e Pouw Triathlon ', '2017-06-17');
INSERT INTO RaceResults (Pos,Bib,Naam,City,PosCat,Cat,Swim,PosSwim,T1,Bike,PosBike,AfterBike,PosAftBike,T2,Run,PosRun,Total,Race,RaceDate) VALUES ('80', '155', 'Thijs de Roo', 'ZWOLLE', '28', 'H16+', '00:18:23', '52', '00:01:09', '01:09:19', '83', '01:28:50', '72', '00:01:16', '00:53:56', '82', '02:24:01', '25e Pouw Triathlon ', '2017-06-17');
INSERT INTO RaceResults (Pos,Bib,Naam,City,Cat,Swim,T1,Bike,AfterBike,T2,Run1,Run2,Run,Total,Race,RaceDate) VALUES ('13', '2', 'Jos Wilbrink', 'GRONINGEN', 'M', '00:17:58', '00:01:15', '01:06:08', '01:25:20', '00:01:14', '00:11:47', '00:11:56', '00:47:35', '02:14:08', 'Triathlon Luttenberg ', '2017-06-11');
INSERT INTO RaceResults (Pos,Bib,Naam,Cat,Swim,PosSwim,T1,Bike,PosBike,AfterBike,T2,Run,PosRun,Total,Race,RaceDate) VALUES ('23', '1', 'Symen de Jong', 'M', '00:14:53', '5', '00:00:45', '00:50:44', '30', '01:06:20', '00:01:06', '00:43:44', '45', '01:51:09', '18e De Flexibele Makelaar Feanster 40 Triathlon   Surhuisterveen   10-06-2017', '2017-06-10'),('43', '94', 'Telma van de Kamp', 'V', '00:17:54', '22', '00:01:09', '00:55:50', '74', '01:14:52', '00:01:55', '00:46:22', '63', '02:03:08', '18e De Flexibele Makelaar Feanster 40 Triathlon   Surhuisterveen   10-06-2017', '2017-06-10');
INSERT INTO RaceResults (Pos,Bib,Naam,City,Cat,PosCat,Swim,PosSwim,T1,Bike,PosBike,AfterBike,PosAftBike,T2,Run,PosRun,Total,Race,RaceDate) VALUES ('82', 'K-104', 'Lilian van Stratum', 'Woerden', 'D20', '6', '00:20:04', '51', '00:02:53', '01:09:16', '91', '01:32:12', '67', '00:02:22', '00:50:03', '103', '02:24:36', '33e Triatlon Woerden 05-06-2017', '2017-06-05');
INSERT INTO RaceResults (Pos,Bib,Cat,Naam,City,Swim,PosSwim,T1,PosT1,Bike,PosBike,AfterBike,PosAftBike,T2,PosT2,Run,PosRun,Total,Race,RaceDate) VALUES ('5', '400', 'MSEN', 'Bram Smit', 'Noordhorn', '00:27:01', '32', '00:01:14', '7', '00:58:14', '1', '01:26:28', '6', '00:01:13', '2', '00:38:48', '7', '02:06:28', '12e Triatlon Amsterdam Nieuw West   04-06-2017', '2017-06-04'),('161', '371', 'MSEN', 'Hielke Nobel', 'Eindhoven', '00:32:27', '112', '00:04:13', '207', '01:17:03', '181', '01:53:42', '162', '00:02:07', '109', '00:52:21', '154', '02:48:10', '12e Triatlon Amsterdam Nieuw West   04-06-2017', '2017-06-04');
INSERT INTO RaceResults (Pos,Bib,Cat,Naam,City,Swim,PosSwim,T1,PosT1,Bike,PosBike,AfterBike,PosAftBike,T2,PosT2,Run,PosRun,Total,Race,RaceDate) VALUES ('18', '580', 'MSEN', 'Ruben Dalfsen', 'Haarlem', '00:14:36', '40', '00:01:14', '6', '00:32:44', '10', '00:48:34', '14', '00:01:25', '6', '00:22:31', '43', '01:12:28', '12e Triatlon Amsterdam Nieuw West   04-06-2017', '2017-06-04');
INSERT INTO RaceResults (Pos,Bib,Naam,Team,Cat,Swim,PosSwim,T1,PosT1,Bike,PosBike,AfterBike,PosAftBike,T2,PosT2,Run,PosRun,Total,Race,RaceDate) VALUES ('3', '771', 'Rutger Duursma', 'Tritanium-tau eem Tammo', 'RecH', '00:02:23', '10', '00:01:44', '6', '00:11:37', '5', '00:15:43', '5', '00:00:57', '3', '00:07:35', '6', '00:24:14', '32e UT-Triathlon ', '2017-05-21'),('5', '751', 'Thijs Wiggers', 'Tritanium-Zinkende Boten #blauwe ballen', 'RecH', '00:03:10', '135', '00:01:42', '3', '00:11:25', '4', '00:16:17', '16', '00:00:59', '6', '00:07:23', '3', '00:24:37', '32e UT-Triathlon ', '2017-05-21'),('11', '725', 'Bram Smit', 'Tritanium-tau eem Tammo', 'RecH', '00:02:45', '52', '00:01:56', '22', '00:11:15', '1', '00:15:55', '7', '00:01:11', '48', '00:08:06', '17', '00:25:10', '32e UT-Triathlon ', '2017-05-21'),('29', '795', 'Harm-Jan Stuut', 'Tritanium-tau eem Tammo', 'RecH', '00:02:43', '50', '00:02:01', '30', '00:12:10', '33', '00:16:53', '31', '00:01:09', '40', '00:08:10', '20', '00:26:10', '32e UT-Triathlon ', '2017-05-21'),('42', '718', 'Vincent Harder', 'Tritanium-Zinkende Boten #blauwe ballen', 'RecH', '00:02:57', '90', '00:01:53', '14', '00:12:35', '58', '00:17:24', '47', '00:01:08', '31', '00:08:41', '47', '00:27:12', '32e UT-Triathlon ', '2017-05-21'),('48', '825', 'Symen de Jong', 'At LeastWeTri', 'RecH', '00:02:27', '19', '00:02:05', '41', '00:12:32', '54', '00:17:03', '35', '00:01:16', '83', '00:09:08', '77', '00:27:26', '32e UT-Triathlon ', '2017-05-21'),('52', '643', 'Franciska Schutter', 'Triteam Groningen2.1', 'RecD', '00:02:54', '79', '00:02:05', '42', '00:12:27', '48', '00:17:25', '48', '00:01:03', '13', '00:09:04', '73', '00:27:32', '32e UT-Triathlon ', '2017-05-21'),('64', '708', 'Harmen Moes', 'Tritanium-tau eem Tammo', 'RecH', '00:02:34', '31', '00:02:16', '84', '00:12:35', '57', '00:17:24', '45', '00:01:32', '146', '00:09:19', '86', '00:28:14', '32e UT-Triathlon ', '2017-05-21'),('73', '675', 'Fenna Heijnen', 'Triteam Groningen2.1', 'RecD', '00:02:52', '72', '00:02:10', '61', '00:13:04', '99', '00:18:06', '76', '00:01:15', '75', '00:09:16', '83', '00:28:36', '32e UT-Triathlon ', '2017-05-21'),('85', '762', 'Rick Nevels', 'Trinanium-David and Goliath', 'RecH', '00:02:49', '68', '00:02:17', '88', '00:13:00', '94', '00:18:05', '74', '00:01:22', '109', '00:09:24', '90', '00:28:50', '32e UT-Triathlon ', '2017-05-21'),('87', '719', 'Ernst van Bergen', 'Trinanium-David and Goliath', 'RecH', '00:03:08', '125', '00:02:29', '130', '00:13:11', '109', '00:18:47', '115', '00:01:38', '168', '00:08:29', '38', '00:28:53', '32e UT-Triathlon ', '2017-05-21'),('96', '732', 'Jens Rasmussen', 'At LeastWeTri', 'RecH', '00:02:51', '71', '00:02:22', '106', '00:12:19', '43', '00:17:31', '52', '00:01:37', '167', '00:10:00', '133', '00:29:07', '32e UT-Triathlon ', '2017-05-21'),('117', '695', 'Alex Tonks', 'Trinanium-David and Goliath', 'RecH', '00:03:00', '100', '00:02:13', '71', '00:13:10', '106', '00:18:23', '90', '00:01:40', '177', '00:09:53', '123', '00:29:56', '32e UT-Triathlon ', '2017-05-21'),('121', '611', 'Marieke van der Zee', 'Tritanium-Pistacheijs', 'RecD', '00:03:30', '168', '00:02:24', '112', '00:13:03', '98', '00:18:55', '125', '00:01:23', '114', '00:09:42', '112', '00:29:59', '32e UT-Triathlon ', '2017-05-21'),('138', '632', 'Marieke van den Brink', 'Tritanium BeterNiet', 'RecD', '00:03:09', '131', '00:02:28', '127', '00:13:54', '157', '00:19:31', '152', '00:01:34', '156', '00:09:45', '115', '00:30:49', '32e UT-Triathlon ', '2017-05-21'),('151', '823', 'David van Eekhout', 'Trinanium-David and Goliath', 'RecH', '00:03:11', '136', '00:02:42', '159', '00:12:29', '50', '00:18:21', '88', '00:01:46', '181', '00:11:17', '181', '00:31:22', '32e UT-Triathlon ', '2017-05-21'),('152', '654', 'Marieke de Graaf', 'Tritanium BeterNiet', 'RecD', '00:03:15', '144', '00:02:27', '121', '00:12:38', '61', '00:18:18', '86', '00:01:38', '169', '00:11:35', '189', '00:31:31', '32e UT-Triathlon ', '2017-05-21'),('162', '639', 'José van der Waa', 'Tritanium-Pistacheijs', 'RecD', '00:03:34', '179', '00:02:41', '157', '00:14:02', '163', '00:20:16', '174', '00:01:57', '196', '00:10:00', '134', '00:32:12', '32e UT-Triathlon ', '2017-05-21'),('167', '665', 'Telma van de Kamp', 'Tritanium-Pistacheijs', 'RecD', '00:03:24', '165', '00:02:50', '172', '00:14:00', '162', '00:20:13', '173', '00:01:47', '185', '00:10:24', '150', '00:32:23', '32e UT-Triathlon ', '2017-05-21'),('180', '664', 'Anne Wouda', 'Tritanium BeterNiet', 'RecD', '00:03:33', '176', '00:02:47', '168', '00:13:43', '144', '00:20:02', '164', '00:02:00', '201', '00:11:15', '178', '00:33:16', '32e UT-Triathlon ', '2017-05-21'),('186', '617', 'Anne Borst', 'Tritanium BeterNiet', 'RecD', '00:03:33', '178', '00:02:43', '161', '00:14:44', '191', '00:20:59', '189', '00:01:35', '160', '00:11:08', '174', '00:33:41', '32e UT-Triathlon ', '2017-05-21'),('204', '627', 'Tess Bosch', 'Tritanium-Pistacheijs', 'RecD', '00:03:39', '188', '00:02:53', '178', '00:14:25', '182', '00:20:57', '188', '00:02:17', '210', '00:12:44', '208', '00:35:57', '32e UT-Triathlon ', '2017-05-21'),('217', '788', 'Jesse Nijboer', 'Tritanium-Zinkende Boten #blauwe ballen', 'RecH', '00:03:10', '', '00:01:57', '', '00:05:46', '', '00:10:52', '', '00:01:07', '', '00:07:32', '', '00:19:30', '32e UT-Triathlon ', '2017-05-21');
INSERT INTO RaceResults (Pos,Bib,Naam,Team,Cat,Swim,PosSwim,T1,PosT1,Bike,PosBike,AfterBike,PosAftBike,T2,PosT2,Run,PosRun,Total,Race,RaceDate) VALUES ('7', '795', 'Harm-Jan Stuut', 'Tritanium-tau eem Tammo', 'RecH', '00:07:32', '42', '00:02:02', '34', '00:28:52', '12', '00:38:25', '20', '00:01:02', '8', '00:18:20', '4', '00:57:46', '32e UT-Triathlon ', '2017-05-21'),('8', '725', 'Bram Smit', 'Tritanium-tau eem Tammo', 'RecH', '00:07:34', '45', '00:02:01', '33', '00:28:49', '10', '00:38:24', '18', '00:01:01', '4', '00:18:22', '5', '00:57:46', '32e UT-Triathlon ', '2017-05-21'),('9', '771', 'Rutger Duursma', 'Tritanium-tau eem Tammo', 'RecH', '00:07:30', '39', '00:01:56', '24', '00:28:59', '18', '00:38:24', '19', '00:00:59', '1', '00:18:24', '6', '00:57:46', '32e UT-Triathlon ', '2017-05-21'),('34', '788', 'Jesse Nijboer', 'Tritanium-Zinkende Boten #blauwe ballen', 'RecH', '00:08:49', '121', '00:02:08', '52', '00:28:57', '16', '00:39:53', '39', '00:01:15', '66', '00:19:25', '25', '01:00:33', '32e UT-Triathlon ', '2017-05-21'),('35', '751', 'Thijs Wiggers', 'Tritanium-Zinkende Boten #blauwe ballen', 'RecH', '00:08:50', '122', '00:02:05', '44', '00:28:55', '15', '00:39:49', '35', '00:01:18', '78', '00:19:26', '26', '01:00:33', '32e UT-Triathlon ', '2017-05-21'),('36', '718', 'Vincent Harder', 'Tritanium-Zinkende Boten #blauwe ballen', 'RecH', '00:08:50', '125', '00:02:05', '39', '00:28:58', '17', '00:39:52', '37', '00:01:10', '40', '00:19:32', '27', '01:00:33', '32e UT-Triathlon ', '2017-05-21'),('39', '825', 'Symen de Jong', 'At LeastWeTri', 'RecH', '00:08:07', '62', '00:01:59', '31', '00:29:56', '42', '00:40:00', '46', '00:01:08', '28', '00:20:54', '52', '01:02:01', '32e UT-Triathlon ', '2017-05-21'),('55', '708', 'Harmen Moes', 'Tritanium-tau eem Tammo', 'RecH', '00:07:36', '48', '00:01:53', '16', '00:29:02', '19', '00:38:30', '21', '00:02:09', '194', '00:23:12', '116', '01:03:51', '32e UT-Triathlon ', '2017-05-21'),('56', '643', 'Franciska Schutter', 'Triteam Groningen2.1', 'RecD', '00:08:38', '99', '00:02:10', '62', '00:30:46', '70', '00:41:32', '69', '00:01:08', '32', '00:21:16', '65', '01:03:55', '32e UT-Triathlon ', '2017-05-21'),('57', '675', 'Fenna Heijnen', 'Triteam Groningen2.1', 'RecD', '00:08:39', '101', '00:02:09', '61', '00:30:47', '71', '00:41:34', '70', '00:01:09', '34', '00:21:14', '63', '01:03:55', '32e UT-Triathlon ', '2017-05-21'),('75', '695', 'Alex Tonks', 'Trinanium-David and Goliath', 'RecH', '00:08:42', '103', '00:02:42', '129', '00:30:29', '57', '00:41:52', '74', '00:01:24', '98', '00:22:25', '82', '01:05:39', '32e UT-Triathlon ', '2017-05-21'),('76', '719', 'Ernst van Bergen', 'Trinanium-David and Goliath', 'RecH', '00:08:45', '110', '00:02:44', '135', '00:30:35', '66', '00:42:03', '76', '00:01:32', '114', '00:22:05', '77', '01:05:39', '32e UT-Triathlon ', '2017-05-21'),('77', '762', 'Rick Nevels', 'Trinanium-David and Goliath', 'RecH', '00:08:42', '105', '00:02:42', '127', '00:30:25', '55', '00:41:48', '72', '00:01:46', '159', '00:22:06', '78', '01:05:39', '32e UT-Triathlon ', '2017-05-21'),('96', '732', 'Jens Rasmussen', 'At LeastWeTri', 'RecH', '00:08:05', '56', '00:02:08', '55', '00:29:48', '37', '00:40:00', '44', '00:01:32', '115', '00:25:12', '145', '01:06:43', '32e UT-Triathlon ', '2017-05-21'),('146', '823', 'David van Eekhout', 'Trinanium-David and Goliath', 'RecH', '00:08:43', '106', '00:02:44', '136', '00:30:30', '62', '00:41:57', '75', '00:01:40', '137', '00:29:44', '193', '01:13:20', '32e UT-Triathlon ', '2017-05-21'),('170', '627', 'Tess Bosch', 'Tritanium-Pistacheijs', 'RecD', '00:09:33', '152', '00:02:54', '161', '00:34:24', '163', '00:46:49', '153', '00:02:04', '183', '00:27:04', '171', '01:15:56', '32e UT-Triathlon ', '2017-05-21'),('171', '665', 'Telma van de Kamp', 'Tritanium-Pistacheijs', 'RecD', '00:09:41', '155', '00:02:50', '151', '00:34:16', '156', '00:46:46', '151', '00:02:04', '184', '00:27:07', '174', '01:15:56', '32e UT-Triathlon ', '2017-05-21'),('172', '639', 'José van der Waa', 'Tritanium-Pistacheijs', 'RecD', '00:09:43', '157', '00:02:49', '149', '00:34:18', '159', '00:46:48', '152', '00:02:04', '182', '00:27:05', '173', '01:15:56', '32e UT-Triathlon ', '2017-05-21'),('173', '611', 'Marieke van der Zee', 'Tritanium-Pistacheijs', 'RecD', '00:09:42', '156', '00:02:45', '141', '00:34:17', '157', '00:46:44', '150', '00:02:10', '196', '00:27:04', '172', '01:15:56', '32e UT-Triathlon ', '2017-05-21'),('213', '617', 'Anne Borst', 'Tritanium BeterNiet', 'RecD', '00:09:27', '', '00:02:44', '', '00:33:32', '', '00:45:41', '', '00:01:33', '', '00:18:07', '', '01:05:20', '32e UT-Triathlon ', '2017-05-21'),('214', '632', 'Marieke van den Brink', 'Tritanium BeterNiet', 'RecD', '00:09:29', '', '00:02:41', '', '00:33:33', '', '00:45:42', '', '00:01:34', '', '00:18:06', '', '01:05:20', '32e UT-Triathlon ', '2017-05-21'),('215', '654', 'Marieke de Graaf', 'Tritanium BeterNiet', 'RecD', '00:09:28', '', '00:02:41', '', '00:33:32', '', '00:45:40', '', '00:01:33', '', '00:18:08', '', '01:05:21', '32e UT-Triathlon ', '2017-05-21'),('216', '664', 'Anne Wouda', 'Tritanium BeterNiet', 'RecD', '00:09:26', '', '00:02:45', '', '', '', '', '', '', '', '', '', '', '32e UT-Triathlon ', '2017-05-21');
INSERT INTO RaceResults (Pos,Bib,Cat,Naam,City,Swim,PosSwim,Bike,PosBike,AfterBike,T2,Run,PosRun,Total,Race,RaceDate) VALUES ('5', '43', 'H24+', 'Jacob Veenstra', 'Groningen', '00:21:18', '5', '00:53:42', '2', '01:15:00', '00:01:19', '00:40:37', '7', '01:56:55', 'Triathlon Heerenveen 20-5-2017', '2017-05-20');
INSERT INTO RaceResults (Pos,Bib,Cat,Naam,City,Swim,PosSwim,Bike,PosBike,AfterBike,T2,Run,PosRun,Total,Race,RaceDate) VALUES ('6', '236', 'H', 'Anton Stempher', 'Groningen', '00:07:46', '4', '00:29:33', '12', '00:37:19', '00:01:03', '00:19:20', '9', '00:57:41', 'Triathlon Heerenveen 20-5-2017', '2017-05-20'),('35', '225', 'H18', 'Jordi Fuhler', 'Klazienaveen', '00:08:36', '15', '02:32:22', '82', '02:40:58', '', '00:23:26', '38', '01:05:47', 'Triathlon Heerenveen 20-5-2017', '2017-05-20');
INSERT INTO RaceResults (Pos,Bib,Naam,City,Cat,Run,PosRun,T1,Bike,PosBike,AfterBike,PosAftBike,T2,Total,Race,RaceDate) VALUES ('33', '453', 'Bart Wolters', 'NIJMEGEN', 'H50+', '00:47:26', '28', '00:02:04', '01:46:18', '54', '02:35:47', '44', '00:04:14', '03:21:36', '9e Winter Triathlon Twente ', '2017-03-25');
INSERT INTO RaceResults (Pos,Bib,Naam,City,Cat,Run,PosRun,T1,Bike,PosBike,AfterBike,PosAftBike,T2,Total,Race,RaceDate) VALUES ('53', '135', 'Harmen Moes', 'GRONINGEN', 'H20+', '00:20:06', '17', '00:02:02', '00:44:54', '26', '01:07:01', '21', '00:03:38', '01:40:42', 'Global Textware NK Wintertriathlon Groningen 04-03-2017', '2017-03-05');
INSERT INTO RaceResults (Pos,Bib,Naam,City,Cat,PosCat,Total,BikePace,Race,RaceDate) VALUES ('618', '1068', 'Frank Janssen', 'Mill', 'M', '594', '11:42:31', '"17', '', 'Drenthe 200 & Ultratrail Drenthe ');
INSERT INTO RaceResults (Pos,Bib,Naam,City,Cat,PosCat,Total,Race,RaceDate) VALUES ('136', '3221', 'Jens Rasmussen', '', 'Mvet', '42', '00:23:17', 'Stadshagen Run Zwolle 15-10-2016', '2016-10-15');
INSERT INTO RaceResults (Pos,Bib,Cat,Naam,City,Run1,#Run1,T1,PosT1,Bike,PosBike,T2,PosT2,Run2,Total,Race,RaceDate) VALUES ('4', '7', 'H20+', 'Thijs Wiggers', 'Groningen', '00:34:42', '5', '00:01:25', '18', '00:59:22', '7', '00:02:12', '7', '00:19:03', '01:56:43', 'NK Run Bike Run ', '2016-10-09');
INSERT INTO RaceResults (Pos,Bib,Naam,City,Cat,Swim,PosSwim,T1,Bike,PosBike,AfterBike,PosAftBike,T2,Run,PosRun,Total,Race,RaceDate) VALUES ('6', '271', 'Bram Smit', 'NOORDHORN', 'M20+', '00:18:29', '40', '00:01:19', '01:03:57', '4', '01:23:44', '7', '00:01:06', '00:39:04', '3', '02:03:53', 'Triathlon Alphen ', '2016-09-25');
INSERT INTO RaceResults (Pos,Bib,Naam,Team,Swim,T1,Bike,AfterBike,T2,Run,Total,Race,RaceDate) VALUES ('24', '115', 'Symen de Jong', 'Triteam Groningen 3', '00:07:58', '00:01:05', '00:27:27', '00:36:29', '00:01:59', '00:21:06', '00:59:33', 'Triathlon Vroomshoop ', '2016-09-17'),('25', '114', 'Bram Smit', 'Triteam Groningen 3', '00:07:58', '00:01:09', '00:27:24', '00:36:30', '00:01:59', '00:21:06', '00:59:34', 'Triathlon Vroomshoop ', '2016-09-17'),('65', '113', 'Jens Rasmussen', 'Triteam Groningen 3', '00:07:58', '00:01:11', '00:27:22', '00:36:30', '00:02:06', '00:24:34', '01:03:08', 'Triathlon Vroomshoop ', '2016-09-17');
INSERT INTO RaceResults (Pos,Bib,Naam,Team,Swim,T1,Bike,AfterBike,T2,Run,Total,Race,RaceDate) VALUES ('19', '205', 'Lilian van Stratum', 'Triteam Groningen 3', '00:08:15', '00:01:17', '00:29:08', '00:38:40', '00:02:04', '00:26:41', '01:07:24', 'Triathlon Vroomshoop ', '2016-09-17');
INSERT INTO RaceResults (Pos,Bib,Naam,City,Cat,Swim,PosSwim,PosBike,AfterBike,PosAftBike,T2,Run,PosRun,Total,Race,RaceDate) VALUES ('28', '300', 'Telma van de Kamp', 'Nes Ameland', 'D20', '00:11:48', '31', '31', '01:41:04', '29', '00:00:52', '00:35:46', '23', '02:17:41', '15e Tri-Ambla Cross Triathlon Ameland 17-09-2016', '2016-09-17');
INSERT INTO RaceResults (Pos,Bib,Naam,Cat,PosCat,Total,Race,RaceDate) VALUES ('74', '1001', 'Lydwien Wilbers', 'V', '3', '01:21:15', 'BurgumRun ', '2016-09-11');
INSERT INTO RaceResults (Pos,Bib,Naam,Cat,PosCat,Total,Race,RaceDate) VALUES ('6', '502', 'Bram Smit', 'M', '6', '00:38:42', 'BurgumRun ', '2016-09-11');
INSERT INTO RaceResults (Pos,Bib,Naam,City,Cat,Swim,PosSwim,T1,Bike,PosBike,AfterBike,PosAftBike,T2,Run1,Run2,Run,PosRun,Total,Race,RaceDate) VALUES ('10', '203', 'Thomas van Belle', 'GRONINGEN', 'H-40', '00:18:58', '19', '00:02:21', '01:14:48', '18', '01:36:06', '11', '00:02:19', '00:11:44', '00:12:39', '00:49:10', '16', '02:27:34', '31e Triathlon Apeldoorn 10-09-2016', '2016-09-10');
INSERT INTO RaceResults (Pos,Bib,Naam,City,Cat,Swim,PosSwim,Bike,PosBike,AfterBike,PosAftBike,Run1,Run2,Run,PosRun,Total,Race,RaceDate) VALUES ('808', '1839', 'Klazina Korver', 'Groningen', 'W24', '00:35:05', '315', '03:29:30', '830', '04:10:24', '802', '00:55:46', '00:57:47', '02:53:35', '807', '07:09:26', '34e Challenge Almere-Amsterdam   10-09-2016', '2016-09-10'),('831', '1809', 'Franciska Schutter', 'Groningen', 'W24', '00:32:37', '173', '02:31:28', '145', '03:07:04', '117', '00:43:31', '', '', '0', '', '34e Challenge Almere-Amsterdam   10-09-2016', '2016-09-10');
INSERT INTO RaceResults (Pos,Bib,Cat,Naam,City,Swim,PosSwim,T1,PosT1,Bike,PosBike,AfterBike,Run,PosRun,Total,Race,RaceDate) VALUES ('25', '660', 'H16+', 'Jordi Fuhler', 'KLAZIENAVEEN', '00:15:49', '33', '00:01:52', '26', '00:36:49', '20', '00:54:28', '00:22:21', '25', '01:16:48', 'Rutbeek Triathlon Enschede 04-09-2016', '2016-09-04'),('31', '680', 'H16+', 'Joost Somsen', 'EIBERGEN', '00:11:39', '14', '00:01:19', '5', '00:31:16', '3', '00:44:12', '', '', '00:44:12', 'Rutbeek Triathlon Enschede 04-09-2016', '2016-09-04');
INSERT INTO RaceResults (Pos,Bib,Naam,City,Cat,PosCat,Swim,PosSwim,T1,Bike,PosBike,AfterBike,PosAftBike,T2,Run,PosRun,Total,Race,RaceDate) VALUES ('117', '489', 'Carmen Scholte Lubberink', 'GRONINGEN', 'V', '19', '00:29:00', '56', '00:01:24', '01:38:25', '151', '02:08:48', '119', '00:01:38', '00:54:06', '110', '03:04:30', 'Keistad Triathlon Amersfoort 04-09-2016', '2016-09-04');
INSERT INTO RaceResults (Pos,Bib,Cat,Naam,City,Swim,PosSwim,T1,PosT1,Bike,PosBike,AfterBike,PosAftBike,T2,PosT2,Run,PosRun,Total,Race,RaceDate) VALUES ('30', '66', 'NK_Hneo', 'Rutger Duursma', 'Triteam Groningen', '00:11:04', '70', '00:00:48', '6', '00:27:31', '52', '00:39:22', '50', '00:00:59', '26', '00:16:45', '26', '00:57:06', '34e van Dijk Triatlon Veenendaal   27-08-2016', '2016-08-27'),('38', '67', 'NK_H', 'Richard Oosterbroek', 'Triteam Groningen', '00:10:38', '52', '00:01:00', '87', '00:27:48', '67', '00:39:25', '56', '00:01:00', '37', '00:17:20', '48', '00:57:45', '34e van Dijk Triatlon Veenendaal   27-08-2016', '2016-08-27'),('52', '59', 'NK_Hjun', 'Joost Somsen', 'Rosiir/step One', '00:12:11', '88', '00:00:53', '44', '00:27:19', '42', '00:40:22', '74', '00:00:55', '8', '00:17:18', '47', '00:58:35', '34e van Dijk Triatlon Veenendaal   27-08-2016', '2016-08-27'),('61', '69', 'NK_H', 'Anton Stempher', 'Triteam Groningen', '00:12:13', '89', '00:00:53', '40', '00:27:17', '38', '00:40:21', '73', '00:00:59', '27', '00:18:16', '66', '00:59:36', '34e van Dijk Triatlon Veenendaal   27-08-2016', '2016-08-27');
INSERT INTO RaceResults (Pos,Bib,Cat,Naam,City,Swim,PosSwim,T1,PosT1,Bike,PosBike,AfterBike,PosAftBike,T2,PosT2,Run,PosRun,Total,Race,RaceDate) VALUES ('42', '28', 'NK_D', 'Franciska Schutter', 'Triteam Groningen', '00:13:32', '56', '00:01:05', '46', '00:31:10', '40', '00:45:46', '46', '00:01:12', '33', '00:21:28', '38', '01:08:25', '34e van Dijk Triatlon Veenendaal   27-08-2016', '2016-08-27'),('43', '40', 'NK_D', 'Fenna Heijnen', 'Triathliem', '00:13:13', '53', '00:01:06', '51', '00:31:29', '45', '00:45:48', '49', '00:01:08', '25', '00:21:47', '41', '01:08:41', '34e van Dijk Triatlon Veenendaal   27-08-2016', '2016-08-27'),('52', '27', 'NK_D', 'Hilde van Loo', 'Triteam Groningen', '00:11:36', '30', '00:01:03', '39', '00:33:09', '49', '00:45:47', '48', '00:01:15', '46', '00:25:16', '52', '01:12:17', '34e van Dijk Triatlon Veenendaal   27-08-2016', '2016-08-27');
INSERT INTO RaceResults (Pos,Bib,Cat,Naam,City,Swim,PosSwim,T1,PosT1,Bike,PosBike,AfterBike,PosAftBike,T2,PosT2,Run,PosRun,Total,Race,RaceDate) VALUES ('211', '549', 'K_H20', 'David van Eekhout', 'EDE', '00:23:51', '223', '00:03:07', '216', '01:06:10', '86', '01:33:07', '141', '00:03:43', '206', '01:03:16', '230', '02:40:05', '34e van Dijk Triatlon Veenendaal   27-08-2016', '2016-08-27');
INSERT INTO RaceResults (Pos,Bib,Naam,City,PosCat,Cat,Swim,PosSwim,T1,Bike,PosBike,AfterBike,PosAftBike,T2,Run,PosRun,Total,Race,RaceDate) VALUES ('62', '234', 'Tess Bosch', 'GRONINGEN', '9', 'D16+', '00:11:55', '51', '00:00:59', '00:42:54', '57', '00:55:47', '50', '00:01:38', '00:31:13', '75', '01:28:37', 'Dion Triathlon ', '2016-08-27');
INSERT INTO RaceResults (Pos,Bib,Naam,City,Cat,PosCat,Swim,PosSwim,T1,Bike,PosBike,AfterBike,PosAftBike,T2,Run,PosRun,Total,Race,RaceDate) VALUES ('1', '41', 'Rutger Duursma', 'Groningen', 'M', '1', '00:07:14', '1', '00:01:00', '00:32:00', '4', '00:40:13', '1', '00:00:24', '00:19:58', '5', '01:00:34', '3e Achtste Triathlon Workum   21-08-2016', '2016-08-21'),('40', '118', 'Elsemieke Stokman', 'Koudum', 'V', '6', '00:09:28', '26', '00:01:04', '00:36:51', '46', '00:47:22', '29', '00:00:39', '00:25:29', '77', '01:13:29', '3e Achtste Triathlon Workum   21-08-2016', '2016-08-21');
INSERT INTO RaceResults (Pos,Bib,Naam,City,Cat,Swim,PosSwim,T1,Bike,PosBike,AfterBike,PosAftBike,T2,Run,PosRun,Total,Race,RaceDate) VALUES ('188', '343', 'Klazina Korver', 'Groningen', 'DS', '00:19:34', '68', '00:01:54', '01:26:11', '186', '01:47:37', '167', '00:01:09', '01:12:01', '203', '03:00:47', 'Kwart(je) & Trio Triathlon Anna Paulowna   20-08-2016', '2016-08-20');
INSERT INTO RaceResults (Pos,Bib,Naam,City,Cat,PosCat,Swim,PosSwim,T1,Bike,PosBike,AfterBike,PosAftBike,T2,Run,PosRun,Total,Race,RaceDate) VALUES ('5', '58', 'Anton Stempher', 'GRONINGEN', 'MSR', '3', '00:17:15', '13', '00:01:13', '01:05:14', '8', '01:23:41', '4', '00:00:24', '00:41:55', '16', '02:05:59', '3e Suydersee Triathlon   Urk   13-08-2016', '2016-08-13'),('40', '57', 'Ruben Dalfsen', 'GRONINGEN', 'MSR', '21', '00:17:30', '16', '00:01:33', '01:10:58', '26', '01:30:00', '17', '00:00:32', '00:54:26', '94', '02:24:57', '3e Suydersee Triathlon   Urk   13-08-2016', '2016-08-13');
INSERT INTO RaceResults (Pos,Total,Bib,Naam,Club,Cat,Swim,Bike,Run,Race,RaceDate) VALUES ('3', '1:58:25', '610', 'Anne Hobbelt', 'triteam groningen 2', 'Vrouw', '0:00:00', '1:11:19', '0:45:39', 'Holten Erediv', '2016-06-30'),('8', '2:01:59', '611', 'Franciska Schutter', 'triteam groningen 2', 'Vrouw', '0:00:00', '1:12:58', '0:36:13', 'Holten Erediv', '2016-06-30');
INSERT INTO RaceResults (Pos,Total,Bib,Naam,Club,Cat,Swim,Bike,Run,Race,RaceDate) VALUES ('2', '1:06:22', '8214', 'Joost Somsen', 'Eibergen', 'Man', '0:07:35', '0:38:16', '0:18:42', 'Holten achtste', '2016-06-30'),('340', '1:38:59', '8337', 'Renske Wold', 'Markelo', 'Vrouw', '0:10:21', '0:50:25', '0:34:00', 'Holten achtste', '2016-06-30');
INSERT INTO RaceResults (Pos,Total,Bib,Naam,City,Cat,Swim,Bike,Run,Race,RaceDate) VALUES ('79', '2:19:12', '3102', 'Jens Rasmussen', 'Groningen', 'Man', '0:11:52', '1:13:09', '0:49:42', 'Holten OD', '2016-06-30'),('257', '2:41:08', '3103', 'Thijs de Roo', 'Zwolle', 'Man', '0:13:47', '1:25:49', '0:58:05', 'Holten OD', '2016-06-30');
INSERT INTO RaceResults (Pos,Bib,Naam,City,Cat,Swim,PosSwim,T1,PosT1,Bike,PosBike,AfterBike,PosAftBike,T2,PosT2,Run,PosRun,Total,Race,RaceDate) VALUES ('4', '573', 'Bram Smit', 'Noordhorn', 'M', '00:26:11', '28', '00:02:06', '12', '01:07:48', '4', '01:36:04', '6', '00:01:16', '4', '00:41:52', '5', '02:19:11', '10e Plus Fischer Triathlon Klazienaveen 17-07-2016', '2016-07-17'),('7', '582', 'Bob Tjaarda', 'Roden', 'M', '00:21:55', '2', '00:01:57', '6', '01:08:57', '8', '01:32:48', '3', '00:01:35', '21', '00:48:26', '25', '02:22:49', '10e Plus Fischer Triathlon Klazienaveen 17-07-2016', '2016-07-17'),('20', '670', 'Franciska Schutter', 'Groningen', 'V', '00:27:06', '35', '00:01:56', '5', '01:12:46', '21', '01:41:46', '20', '00:01:20', '12', '00:49:21', '28', '02:32:27', '10e Plus Fischer Triathlon Klazienaveen 17-07-2016', '2016-07-17'),('22', '594', 'Jos Wilbrink', 'Groningen', 'M', '00:27:17', '41', '00:02:17', '21', '01:13:01', '24', '01:42:34', '24', '00:01:39', '29', '00:49:41', '33', '02:33:53', '10e Plus Fischer Triathlon Klazienaveen 17-07-2016', '2016-07-17'),('120', '660', 'Klazina Korver', 'Groningen', 'V', '00:27:32', '46', '00:02:24', '29', '01:33:50', '122', '02:03:46', '102', '00:01:58', '56', '01:20:46', '129', '03:26:29', '10e Plus Fischer Triathlon Klazienaveen 17-07-2016', '2016-07-17');
INSERT INTO RaceResults (Pos,Bib,Naam,City,Cat,Swim,PosSwim,T1,PosT1,Bike,PosBike,AfterBike,PosAftBike,T2,PosT2,Run,PosRun,Total,Race,RaceDate) VALUES ('52', '1115', 'Jordi Fuhler', 'Klazienaveen', 'M', '00:10:31', '79', '00:02:38', '58', '00:37:40', '46', '00:50:48', '53', '00:01:58', '69', '00:26:14', '62', '01:18:59', '10e Plus Fischer Triathlon Klazienaveen 17-07-2016', '2016-07-17'),('82', '1281', 'Anne Wouda', 'Groningen', 'V', '00:09:23', '46', '00:02:48', '69', '00:41:10', '92', '00:53:21', '75', '00:02:15', '107', '00:29:03', '96', '01:24:38', '10e Plus Fischer Triathlon Klazienaveen 17-07-2016', '2016-07-17');
INSERT INTO RaceResults (Pos,Bib,Naam,City,Cat,Swim,PosSwim,T1,PosT1,Bike,PosBike,AfterBike,PosAftBike,T2,PosT2,Run,PosRun,Total,Race,RaceDate) VALUES ('60', '67', 'Harm-Jan Stuut', 'Groningen', 'H20+', '00:31:39', '99', '00:02:37', '124', '02:24:17', '69', '02:58:31', '72', '00:01:31', '18', '01:38:20', '62', '04:38:20', '10e Plus Fischer Triathlon Klazienaveen 17-07-2016', '2016-07-17');
INSERT INTO RaceResults (Pos,Bib,Naam,City,Cat,PosCat,Total,Race,RaceDate) VALUES ('154', '188', 'Marieke van den Brink', 'Barneveld', 'V-30', '26', '01:39:42', 'Bergrace Trailrunning Lunteren 3-7-2016', '2016-07-03'),('257', '211', 'Frank Janssen', 'Lisse', 'M-35', '184', '02:04:47', 'Bergrace Trailrunning Lunteren 3-7-2016', '2016-07-03');
INSERT INTO RaceResults (Pos,Bib,Naam,City,Cat,PosCat,Swim,PosSwim,T1,Bike,PosBike,AfterBike,PosAftBike,T2,Run,PosRun,Total,Race,RaceDate) VALUES ('4', '922', 'Richard Oosterbroek', 'GSTV Tritanium', 'M18', '3', '00:10:38', '1', '00:01:35', '00:31:58', '5', '00:44:10', '2', '00:01:00', '00:18:46', '6', '01:03:55', '24e Triatlon Didam 03-07-2016', '2016-07-02'),('13', '889', 'Fenna Heijnen', 'Triathliem', 'V18', '3', '00:13:09', '21', '00:01:42', '00:36:02', '39', '00:50:52', '20', '00:01:05', '00:20:15', '17', '01:12:11', '24e Triatlon Didam 03-07-2016', '2016-07-02'),('38', '935', 'Marieke van der Zee', '', 'V18', '7', '00:16:05', '57', '00:02:00', '00:36:43', '48', '00:54:46', '45', '00:01:24', '00:22:46', '48', '01:18:55', '24e Triatlon Didam 03-07-2016', '2016-07-02');
INSERT INTO RaceResults (Pos,Total,Bib,Naam,Club,Cat,Swim,Bike,Run,Race,RaceDate) VALUES ('29', '2:15:05', '526', 'Edwin Dasselaar', 'triteam groningen 2', 'Man', '0:23:09', '1:08:11', '0:40:58', 'Holten EreDivisie OD', '2016-06-30'),('32', '2:16:14', '528', 'Harm-Jan Stuut', 'triteam groningen 2', 'Man', '0:24:07', '1:08:30', '0:40:46', 'Holten EreDivisie OD', '2016-06-30');
INSERT INTO RaceResults (Pos,Bib,Cat,Naam,Run1,T1,Bike,PosBike,AfterBike,T2,Run2,PosRun2,Total,Race,RaceDate) VALUES ('1', '29', 'Man 40-', 'Thijs Wiggers', '00:24:39', '00:00:35', '00:43:29', '1', '01:08:42', '00:00:24', '00:13:08', '4', '01:22:13', 'Run Bike Run Deurningen 26-06-2016', '2016-06-26'),('14', '2', 'Dames', 'Anne Hobbelt', '00:28:42', '00:00:46', '00:49:20', '19', '01:18:47', '00:00:28', '00:14:58', '13', '01:34:12', 'Run Bike Run Deurningen 26-06-2016', '2016-06-26');
INSERT INTO RaceResults (Pos,Bib,Cat,Naam,Swim,T1,Bike,AfterBike,T2,Run1,Run2,Run,Race,RaceDate) VALUES ('1', '326', 'H18', 'Rutger Duursma', '00:20:50', '00:00:37', '00:57:02', '01:18:28', '00:00:28', '00:09:26', '00:09:42', '00:37:58', '4e Zeewolde Endurance Triathlon   25-06-2016', '2016-06-25'),('11', '328', 'H24', 'Jos Wilbrink', '00:27:05', '00:01:06', '00:59:11', '01:27:21', '00:00:58', '00:10:46', '00:10:29', '00:41:43', '4e Zeewolde Endurance Triathlon   25-06-2016', '2016-06-25');
INSERT INTO RaceResults (Pos,Bib,Cat,Naam,Swim,PosSwim,T1,PosT1,Bike,PosBike,AfterBike,PosAftBike,T2,PosT2,Run,PosRun,Total,Difference,Race,RaceDate) VALUES ('1', '326', 'H18', 'Rutger Duursma', '00:20:50', '1', '00:00:37', '1', '00:57:02', '3', '01:18:28', '1', '00:00:28', '1', '00:37:58', '1', '01:56:53', '', '4e Zeewolde Endurance Triathlon   25-06-2016', '2016-06-25'),('11', '328', 'H24', 'Jos Wilbrink', '00:27:05', '32', '00:01:06', '25', '00:59:11', '12', '01:27:21', '17', '00:00:58', '28', '00:41:43', '16', '02:10:02', '00:13:09', '4e Zeewolde Endurance Triathlon   25-06-2016', '2016-06-25');
INSERT INTO RaceResults (Pos,Bib,Cat,Naam,Swim,T1,Bike,AfterBike,T2,Run1,Run2,Run,Race,RaceDate) VALUES ('25', '718', 'D18', 'Marieke van den Brink', '00:11:22', '00:01:57', '00:38:29', '00:51:47', '00:01:29', '00:11:30', '00:11:14', '00:22:44', '4e Zeewolde Endurance Triathlon   25-06-2016', '2016-06-25');
INSERT INTO RaceResults (Pos,Bib,Cat,Naam,Swim,PosSwim,T1,PosT1,Bike,PosBike,AfterBike,PosAftBike,T2,PosT2,Run,PosRun,Total,Difference,Race,RaceDate) VALUES ('18', '718', 'D18', 'Marieke van den Brink', '00:11:22', '20', '00:01:57', '45', '00:38:29', '26', '00:51:47', '23', '00:01:29', '41', '00:22:44', '17', '01:15:58', '00:16:20', '4e Zeewolde Endurance Triathlon   25-06-2016', '2016-06-25');
INSERT INTO RaceResults (Pos,Bib,Cat,Naam,Club,Swim,PosSwim,T1,PosT1,Bike,PosBike,AfterBike,PosAftBike,T2,PosT2,Run,PosRun,Total,Difference,Race,RaceDate) VALUES ('23', '115', 'D2M', 'Symen de Jong', 'Triteam Groningen 3', '21:12', '5', '00:47', '35', '01:00:35', '52', '01:22:33', '16', '00:33', '11', '42:31', '44', '02:05:37', '08:58', 'Zeewolde 2eDiv Heren', '2016-06-25'),('53', '114', 'D2M', 'Jens Rasmussen', 'Triteam Groningen 3', '24:36', '31', '01:10', '71', '57:20', '17', '01:23:06', '21', '00:43', '37', '47:23', '75', '02:11:10', '14:31', 'Zeewolde 2eDiv Heren', '2016-06-25');
INSERT INTO RaceResults (Pos,Bib,Naam,Swim,PosSwim,T1,PosT1,Bike,PosBike,T2,PosT2,Run,PosRun,Total,Race,RaceDate) VALUES ('3', '807', 'Bob Tjaarda', '0:11:13', '5', '0:01:05', '5', '1:09:35', '8', '0:00:51', '4', '0:38:03', '6', '2:00:45', 'Speedman Kwart M', '2016-06-19'),('4', '871', 'Anton Stempher', '0:12:22', '11', '0:01:01', '3', '1:09:58', '12', '0:00:42', '1', '0:36:47', '3', '2:00:49', 'Speedman Kwart M', '2016-06-19');
INSERT INTO RaceResults (Pos,Bib,Naam,Swim,PosSwim,T1,PosT1,Bike,PosBike,T2,PosT2,Run,PosRun,Total,Race,RaceDate) VALUES ('6', '899', 'Sandra van Diemen', '0:17:50', '12', '0:02:32', '9', '1:15:45', '1', '0:02:48', '12', '0:53:18', '9', '2:32:11', 'Speedman Kwart D', '2016-06-19');
INSERT INTO RaceResults (Pos,Bib,Naam,Swim,PosSwim,T1,PosT1,Bike,PosBike,T2,PosT2,Run,PosRun,Total,Race,RaceDate) VALUES ('1', '751', 'Rutger Duursma', '0:05:41', '1', '0:00:54', '1', '0:36:45', '2', '0:00:41', '1', '0:17:29', '1', '1:01:29', 'Speedman achtste M', '2016-06-19'),('3', '741', 'Bram Smit', '0:07:19', '18', '0:01:11', '4', '0:37:02', '3', '0:00:50', '4', '0:17:38', '2', '1:03:58', '', '2016-06-19'),('11', '691', 'Jens Rasmussen', '0:06:37', '5', '0:01:22', '11', '0:39:15', '7', '0:01:08', '19', '0:21:17', '19', '1:09:38', '', '2016-06-19'),('21', '745', 'Alex Tonks', '0:07:17', '15', '0:01:15', '6', '0:43:07', '37', '0:00:57', '8', '0:21:51', '29', '1:14:25', '', '2016-06-19');
INSERT INTO RaceResults (Pos,Bib,Naam,Swim,PosSwim,T1,PosT1,Bike,PosBike,T2,PosT2,Run,PosRun,Total,Race,RaceDate) VALUES ('2', '771', 'Franciska Schutter', '0:07:22', '9', '0:01:09', '3', '0:40:15', '2', '0:01:07', '10', '0:21:17', '3', '1:11:08', 'Speedman achtste D', '2016-06-19'),('3', '764', 'Rebeka Rizmanová', '0:06:14', '1', '0:01:01', '1', '0:43:37', '7', '0:00:46', '1', '0:21:01', '2', '1:12:38', 'Speedman achtste D', '2016-06-19'),('18', '727', 'Anne Wouda', '0:08:36', '20', '0:01:56', '24', '0:46:08', '17', '0:01:17', '18', '0:25:14', '25', '1:23:10', 'Speedman achtste D', '2016-06-19'),('33', '759', 'Klazina Korver', '0:07:41', '10', '0:01:35', '14', '0:49:09', '29', '0:01:17', '17', '0:30:01', '45', '1:29:41', '', '2016-06-19');
INSERT INTO RaceResults (Pos,Bib,Naam,Swim,PosSwim,T1,PosT1,Bike,PosBike,T2,PosT2,Run,PosRun,Total,Race,RaceDate) VALUES ('47', '114', 'Ruben Dalfsen', '0:07:04', '53', '0:00:52', '4', '0:37:43', '29', '0:00:50', '7', '0:22:13', '68', '1:08:40', 'Speedman 2eDiv achtste M', '2016-06-19'),('56', '115', 'Symen de Jong', '0:05:56', '6', '0:01:05', '30', '0:38:33', '44', '0:01:01', '42', '0:23:07', '71', '1:09:39', '', '2016-06-19');
INSERT INTO RaceResults (Pos,Bib,Naam,Swim,PosSwim,T1,PosT1,Bike,PosBike,T2,PosT2,Run,PosRun,Total,Race,RaceDate) VALUES ('2', '206', 'Elsemieke Stokman', '0:07:02', '12', '0:00:58', '4', '0:39:44', '4', '0:00:54', '3', '0:22:16', '20', '1:10:53', 'Speedman 2eDiv achtste D', '2016-06-19'),('29', '207', 'Lilian van Stratum', '0:07:46', '30', '0:00:56', '3', '0:44:18', '40', '0:00:55', '6', '0:22:50', '31', '1:16:44', '', '2016-06-19');
INSERT INTO RaceResults (Pos,Bib,Naam,City,PosCat,Cat,Swim,PosSwim,T1,Bike,PosBike,AfterBike,PosAftBike,T2,Run,PosRun,Total,Race,RaceDate) VALUES ('2', '521', 'Richard Oosterbroek', 'GRONINGEN', '2', 'H14+', '00:06:16', '1', '00:00:40', '00:29:05', '3', '00:36:00', '1', '00:00:33', '00:18:23', '5', '00:54:55', '24e Pouw Triathlon ', '2016-06-18'),('105', '1118', 'Marloes Nies', 'GRONINGEN', '11', 'D14+', '00:10:03', '99', '00:00:55', '00:36:07', '137', '00:47:03', '112', '00:00:45', '00:25:03', '113', '01:12:50', '24e Pouw Triathlon ', '2016-06-18');
INSERT INTO RaceResults (Pos,Bib,Naam,City,PosCat,Cat,Swim,PosSwim,T1,Bike,PosBike,AfterBike,PosAftBike,T2,Run,PosRun,Total,Race,RaceDate) VALUES ('88', '138', 'Thijs de Roo', 'ZWOLLE', '29', 'H16+', '00:17:46', '53', '00:01:32', '01:13:51', '97', '01:33:09', '91', '00:01:02', '00:53:59', '78', '02:28:08', '24e Pouw Triathlon ', '2016-06-18');
INSERT INTO RaceResults (Pos,Bib,Naam,Cat,Swim,PosSwim,T1,Bike,PosBike,AfterBike,T2,Run,PosRun,Total,Race,RaceDate) VALUES ('7', '1', 'Symen de Jong', 'M', '00:14:34', '2', '00:00:46', '00:46:39', '11', '01:01:58', '00:01:11', '00:38:31', '20', '01:41:40', '17e De Flexibele Makelaar Feanster 40 Triathlon   Surhuisterveen   11-06-2016', '2016-06-11'),('8', '12', 'Harm-Jan Stuut', 'M', '00:15:55', '11', '00:01:04', '00:47:51', '20', '01:04:49', '00:01:23', '00:35:38', '8', '01:41:49', '17e De Flexibele Makelaar Feanster 40 Triathlon   Surhuisterveen   11-06-2016', '2016-06-11'),('17', '603', 'Franciska Schutter', 'V', '00:16:43', '17', '00:00:38', '00:48:24', '24', '01:05:44', '00:01:21', '00:40:45', '38', '01:47:49', '17e De Flexibele Makelaar Feanster 40 Triathlon   Surhuisterveen   11-06-2016', '2016-06-11');
INSERT INTO RaceResults (Pos,Bib,Naam,City,Cat,PosCat,Total,Race,RaceDate) VALUES ('388', '3794', 'Marieke van den Brink', 'Barneveld', 'Vrouw', '50', '00:49:50', 'Amersfoort Marathon   05-06-2016', '2016-06-05');
INSERT INTO RaceResults (Pos,Bib,Naam,City,Cat,Swim,PosSwim,T1,Bike,PosBike,AfterBike,PosAftBike,T2,Run,PosRun,Total,Race,RaceDate) VALUES ('111', '387', 'Joost Somsen', 'EIBERGEN', 'H16+', '00:08:08', '34', '00:00:49', '00:38:46', '217', '00:47:42', '120', '00:02:39', '00:23:30', '85', '01:13:51', '2e Univé Oost Hof van Twente Triathlon ', '2016-05-29');
INSERT INTO RaceResults (Pos,Bib,Cat,Naam,City,Swim,PosSwim,Bike,PosBike,AfterBike,T2,Run,PosRun,Total,Race,RaceDate) VALUES ('2', '338', 'D', 'Marieke van der Zee', 'Groningen', '00:05:03', '5', '00:16:46', '2', '00:21:49', '00:01:33', '00:07:24', '4', '00:30:44', 'Triathlon Heerenveen 28-5-2016', '2016-05-28');
INSERT INTO RaceResults (Pos,Bib,Cat,Naam,City,Swim,PosSwim,Bike,PosBike,AfterBike,T2,Run,PosRun,Total,Race,RaceDate) VALUES ('3', '183', 'H', 'Anton Stempher', 'Groningen', '00:08:23', '6', '00:27:15', '1', '00:35:38', '00:00:59', '00:18:29', '3', '00:55:05', 'Triathlon Heerenveen 28-5-2016', '2016-05-28'),('27', '285', 'D', 'Elsemieke Stokman', 'Groningen', '00:09:41', '32', '00:30:11', '22', '00:39:51', '00:01:15', '00:23:30', '60', '01:04:35', 'Triathlon Heerenveen 28-5-2016', '2016-05-28'),('74', '276', 'D18', 'Marieke van den Brink', 'Haren Gn', '00:11:17', '76', '00:34:59', '90', '00:46:16', '00:02:22', '00:23:30', '59', '01:12:07', 'Triathlon Heerenveen 28-5-2016', '2016-05-28');
INSERT INTO RaceResults (Pos,Bib,Cat,Naam,Team,Run1,T1,Bike,PosBike,AfterBike,T2,Run2,PosRun2,Total,Race,RaceDate) VALUES ('4', '59', 'M', 'Thijs Wiggers', 'TTvW - Hof van Twente', '00:08:34', '00:00:36', '00:35:09', '3', '00:43:40', '00:00:38', '00:18:04', '6', '01:02:21', 'Run Bike Run Hoogerheide 22-05-2016', '2016-05-22');
INSERT INTO RaceResults (Pos,Bib,Naam,Cat,PosCat,Total,Race,RaceDate) VALUES ('12', '368', 'Joost Somsen', 'Msen', '8', '00:10:24', '33e FBK Dubbele Mijl   Hengelo   19-05-2016', '2016-05-19');
